水 怎么 不 热 ？,水怎么不热？,shǔi zěnyāo bù rè ？,Why isn't the water hot?,[sound:hsk2_grammar_sent748.mp3],:: Subj. + 怎么 (+ 不) + Adj. ::,"Asking questions, Exclaiming, Expressing attitude","Asking why with ""zenme""",https://resources.allsetlearning.com/chinese/grammar/ASGD7NS3
这里 的 川菜 怎么 不 辣 ？,这里的川菜怎么不辣？,zhèlǐ de chuāncài zěnyāo bù là ？,Why isn't Sichuan food spicy here?,[sound:hsk2_grammar_sent749.mp3],:: Subj. + 怎么 (+ 不) + Adj. ::,"Asking questions, Exclaiming, Expressing attitude","Asking why with ""zenme""",https://resources.allsetlearning.com/chinese/grammar/ASGD7NS3
他 亲 了 你，你 怎么 不 高兴 ？,他亲了你，你怎么不高兴？,tā qīn le nǐ，nǐ zěnyāo bù gāoxīng ？,"He kissed you, why are you upset?",[sound:hsk2_grammar_sent750.mp3],:: Subj. + 怎么 (+ 不) + Adj. ::,"Asking questions, Exclaiming, Expressing attitude","Asking why with ""zenme""",https://resources.allsetlearning.com/chinese/grammar/ASGD7NS3
她 的 小猫 死 了，她 怎么 不 难过 ？,她的小猫死了，她怎么不难过？,tā de xiǎomāo sǐ le，tā zěnyāo bù nánguò ？,"Her kitten is dead, why isn't she sad?",[sound:hsk2_grammar_sent751.mp3],:: Subj. + 怎么 (+ 不) + Adj. ::,"Asking questions, Exclaiming, Expressing attitude","Asking why with ""zenme""",https://resources.allsetlearning.com/chinese/grammar/ASGD7NS3
每 天 工作 十二 个 小时 ，你 怎么 不 累 ？,每天工作十二个小时，你怎么不累？,měi tiān gōngzuò shíèr gè xiǎoshí ，nǐ zěnyāo bù lèi ？,"Working twelve hours a day, why are you not tired?",[sound:hsk2_grammar_sent752.mp3],:: Subj. + 怎么 (+ 不) + Adj. ::,"Asking questions, Exclaiming, Expressing attitude","Asking why with ""zenme""",https://resources.allsetlearning.com/chinese/grammar/ASGD7NS3
他 怎么 那么 懒 ？,他怎么那么懒？,tā zěnyāo nàyāo lǎn ？,Why is he so lazy?,[sound:hsk2_grammar_sent753.mp3],:: Subj. + 怎么 + 这么 / 那么 + Adj. ::,"Asking questions, Exclaiming, Expressing attitude","Asking why with ""zenme""",https://resources.allsetlearning.com/chinese/grammar/ASGD7NS3
昨天 怎么 那么 冷 ？,昨天怎么那么冷？,zuótiān zěnyāo nàyāo lěng ？,Why was it so cold yesterday?,[sound:hsk2_grammar_sent754.mp3],:: Subj. + 怎么 + 这么 / 那么 + Adj. ::,"Asking questions, Exclaiming, Expressing attitude","Asking why with ""zenme""",https://resources.allsetlearning.com/chinese/grammar/ASGD7NS3
这些人 怎么 这么 吵 ？,这些人怎么这么吵？,zhèxiērén zěnyāo zhèyāo chǎo ？,Why are these people so noisy?,[sound:hsk2_grammar_sent755.mp3],:: Subj. + 怎么 + 这么 / 那么 + Adj. ::,"Asking questions, Exclaiming, Expressing attitude","Asking why with ""zenme""",https://resources.allsetlearning.com/chinese/grammar/ASGD7NS3
北京 的 空气 怎么 那么 差 ？,北京的空气怎么那么差？,běijīng de kōngqì zěnyāo nàyāo chà ？,Why is the air in Beijing so bad?,[sound:hsk2_grammar_sent756.mp3],:: Subj. + 怎么 + 这么 / 那么 + Adj. ::,"Asking questions, Exclaiming, Expressing attitude","Asking why with ""zenme""",https://resources.allsetlearning.com/chinese/grammar/ASGD7NS3
你的 汉语 怎么 这么 好 ？,你的汉语怎么这么好？,nǐde hànyǔ zěnyāo zhèyāo hǎo ？,How is your Chinese so good?,[sound:hsk2_grammar_sent757.mp3],:: Subj. + 怎么 + 这么 / 那么 + Adj. ::,"Asking questions, Exclaiming, Expressing attitude","Asking why with ""zenme""",https://resources.allsetlearning.com/chinese/grammar/ASGD7NS3
A: 你 看 到 我 的 手机 了 吗 ？,A:你看到我的手机了吗？,A: nǐ kàn dào wǒ de shǒujī le ma ？,A: Did you see my mobile phone?,[sound:hsk2_grammar_sent758.mp3],(能……吗？) / (不是……吗？ ) / ( 怎么会……？ ) / ( 谁让你……？),"Asking questions, Expressing attitude",Simple rhetorical questions,https://resources.allsetlearning.com/chinese/grammar/ASGD4EC8
B:不 是 在 桌子 上 吗 ？,B:不是在桌子上吗？,B:bù shì zài zhuōzǐ shàng ma ？,B: Isn't it on the table?,[sound:hsk2_grammar_sent759.mp3],(能……吗？) / (不是……吗？ ) / ( 怎么会……？ ) / ( 谁让你……？),"Asking questions, Expressing attitude",Simple rhetorical questions,https://resources.allsetlearning.com/chinese/grammar/ASGD4EC8
A: 我们 什么 时候 开会 ？,A:我们什么时候开会？,A: wǒmen shíyāo shíhòu kāihùi ？,A: When will we meet?,[sound:hsk2_grammar_sent760.mp3],(能……吗？) / (不是……吗？ ) / ( 怎么会……？ ) / ( 谁让你……？),"Asking questions, Expressing attitude",Simple rhetorical questions,https://resources.allsetlearning.com/chinese/grammar/ASGD4EC8
B:不 是 已经 告诉 你 了 吗 ？,B:不是已经告诉你了吗？,B:bù shì yǐjīng gàosù nǐ le ma ？,B: Didn't I tell you?,[sound:hsk2_grammar_sent761.mp3],(能……吗？) / (不是……吗？ ) / ( 怎么会……？ ) / ( 谁让你……？),"Asking questions, Expressing attitude",Simple rhetorical questions,https://resources.allsetlearning.com/chinese/grammar/ASGD4EC8
A: 今天 放假 了，好 开心 。,A:今天放假了，好开心。,A: jīntiān fàngjiǎ le，hǎo kāixīn 。,"A: I have a holiday today, so happy.",[sound:hsk2_grammar_sent762.mp3],(能……吗？) / (不是……吗？ ) / ( 怎么会……？ ) / ( 谁让你……？),"Asking questions, Expressing attitude",Simple rhetorical questions,https://resources.allsetlearning.com/chinese/grammar/ASGD4EC8
B:不 是 明天 放假 吗 ？,B:不是明天放假吗？,B:bù shì míngtiān fàngjiǎ ma ？,B: Isn't it a holiday tomorrow?,[sound:hsk2_grammar_sent763.mp3],(能……吗？) / (不是……吗？ ) / ( 怎么会……？ ) / ( 谁让你……？),"Asking questions, Expressing attitude",Simple rhetorical questions,https://resources.allsetlearning.com/chinese/grammar/ASGD4EC8
A: 他 又 感冒 了 。,A:他又感冒了。,A: tā yòu gǎnmào le 。,A: He has a cold again.,[sound:hsk2_grammar_sent764.mp3],(能……吗？) / (不是……吗？ ) / ( 怎么会……？ ) / ( 谁让你……？),"Asking questions, Expressing attitude",Simple rhetorical questions,https://resources.allsetlearning.com/chinese/grammar/ASGD4EC8
B: 他 每天 穿得 都 很少，能 不 感冒 吗 ？,B:他每天穿得都很少，能不感冒吗？,B: tā měitiān chuāndé dū hěnshǎo，néng bù gǎnmào ma ？,"B: He wears very little every day, can he not catch a cold?",[sound:hsk2_grammar_sent765.mp3],(能……吗？) / (不是……吗？ ) / ( 怎么会……？ ) / ( 谁让你……？),"Asking questions, Expressing attitude",Simple rhetorical questions,https://resources.allsetlearning.com/chinese/grammar/ASGD4EC8
A: 今天 我 可能 会 迟到 。,A:今天我可能会迟到。,A: jīntiān wǒ kěnéng hùi chídào 。,A: I may be late today.,[sound:hsk2_grammar_sent766.mp3],(能……吗？) / (不是……吗？ ) / ( 怎么会……？ ) / ( 谁让你……？),"Asking questions, Expressing attitude",Simple rhetorical questions,https://resources.allsetlearning.com/chinese/grammar/ASGD4EC8
B:你 起得 这么 晚，能 不 迟到 吗 ？,B:你起得这么晚，能不迟到吗？,B:nǐ qǐdé zhèyāo wǎn，néng bù chídào ma ？,"B: You get up so late, can you not be late?",[sound:hsk2_grammar_sent767.mp3],(能……吗？) / (不是……吗？ ) / ( 怎么会……？ ) / ( 谁让你……？),"Asking questions, Expressing attitude",Simple rhetorical questions,https://resources.allsetlearning.com/chinese/grammar/ASGD4EC8
A: 我 点 了 很多 菜，都是 你 爱 吃 的 。,A:我点了很多菜，都是你爱吃的。,A: wǒ diǎn le hěnduō cài，dūshì nǐ ài chī de 。,"A: I have ordered a lot of dishes, which are all your favorite.",[sound:hsk2_grammar_sent768.mp3],(能……吗？) / (不是……吗？ ) / ( 怎么会……？ ) / ( 谁让你……？),"Asking questions, Expressing attitude",Simple rhetorical questions,https://resources.allsetlearning.com/chinese/grammar/ASGD4EC8
B:晚上 吃 这么 多 菜，能 不 胖 吗 ？,B:晚上吃这么多菜，能不胖吗？,B:wǎnshàng chī zhèyāo duō cài，néng bù pàng ma ？,B: Can you eat so many dishes at night?,[sound:hsk2_grammar_sent769.mp3],(能……吗？) / (不是……吗？ ) / ( 怎么会……？ ) / ( 谁让你……？),"Asking questions, Expressing attitude",Simple rhetorical questions,https://resources.allsetlearning.com/chinese/grammar/ASGD4EC8
A: 他们 公司 很 厉害 。,A:他们公司很厉害。,A: tāmen gōngsī hěn lìhài 。,A: Their company is very powerful.,[sound:hsk2_grammar_sent770.mp3],(能……吗？) / (不是……吗？ ) / ( 怎么会……？ ) / ( 谁让你……？),"Asking questions, Expressing attitude",Simple rhetorical questions,https://resources.allsetlearning.com/chinese/grammar/ASGD4EC8
B:但是 他们 公司 怎么 会 有 这么 笨 的 员工 ？,B:但是他们公司怎么会有这么笨的员工？,B:dànshì tāmen gōngsī zěnyāo hùi yǒu zhèyāo bèn de yuángōng ？,B: But how can their company have such stupid employees?,[sound:hsk2_grammar_sent771.mp3],(能……吗？) / (不是……吗？ ) / ( 怎么会……？ ) / ( 谁让你……？),"Asking questions, Expressing attitude",Simple rhetorical questions,https://resources.allsetlearning.com/chinese/grammar/ASGD4EC8
A: 我 收到 了 你 的 邮件 。,A:我收到了你的邮件。,A: wǒ shōudào le nǐ de yóujiàn 。,A: I received your email.,[sound:hsk2_grammar_sent772.mp3],(能……吗？) / (不是……吗？ ) / ( 怎么会……？ ) / ( 谁让你……？),"Asking questions, Expressing attitude",Simple rhetorical questions,https://resources.allsetlearning.com/chinese/grammar/ASGD4EC8
B:那 你 怎么 会 不 知道 ？,B:那你怎么会不知道？,B:nà nǐ zěnyāo hùi bù zhīdào ？,B: Then why don't you know?,[sound:hsk2_grammar_sent773.mp3],(能……吗？) / (不是……吗？ ) / ( 怎么会……？ ) / ( 谁让你……？),"Asking questions, Expressing attitude",Simple rhetorical questions,https://resources.allsetlearning.com/chinese/grammar/ASGD4EC8
A:我 感觉 最近 有 一点 胖 了 。,A:我感觉最近有一点胖了。,A:wǒ gǎnjué zùijìn yǒu yīdiǎn pàng le 。,A: I feel a little bit fat recently.,[sound:hsk2_grammar_sent774.mp3],(能……吗？) / (不是……吗？ ) / ( 怎么会……？ ) / ( 谁让你……？),"Asking questions, Expressing attitude",Simple rhetorical questions,https://resources.allsetlearning.com/chinese/grammar/ASGD4EC8
B:谁 让 你 吃 这么 多 ？,B:谁让你吃这么多？,B:shúi ràng nǐ chī zhèyāo duō ？,B: Who made you eat so much?,[sound:hsk2_grammar_sent775.mp3],(能……吗？) / (不是……吗？ ) / ( 怎么会……？ ) / ( 谁让你……？),"Asking questions, Expressing attitude",Simple rhetorical questions,https://resources.allsetlearning.com/chinese/grammar/ASGD4EC8
A:我 找 不到 我 的 钥匙 了 。,A:我找不到我的钥匙了。,A:wǒ zhǎo bùdào wǒ de yàochí le 。,A: I can't find my key.,[sound:hsk2_grammar_sent776.mp3],(能……吗？) / (不是……吗？ ) / ( 怎么会……？ ) / ( 谁让你……？),"Asking questions, Expressing attitude",Simple rhetorical questions,https://resources.allsetlearning.com/chinese/grammar/ASGD4EC8
B:谁 让 你 不 放 在 包 里 。,B:谁让你不放在包里。,B:shúi ràng nǐ bù fàng zài bāo lǐ 。,B: Who told you not to put it in your bag.,[sound:hsk2_grammar_sent777.mp3],(能……吗？) / (不是……吗？ ) / ( 怎么会……？ ) / ( 谁让你……？),"Asking questions, Expressing attitude",Simple rhetorical questions,https://resources.allsetlearning.com/chinese/grammar/ASGD4EC8
你 会 说 中文 ， 对 不 对 ？,你会说中文，对不对？,nǐ hùi shuō zhōngwén ， dùi bù dùi ？,"You can speak Chinese, right?",[sound:hsk2_grammar_sent778.mp3],:: Verb + 不 + Verb ::,"Asking questions, Giving alternatives","Tag questions with ""bu""",https://resources.allsetlearning.com/chinese/grammar/ASG4D8XB
他 是 你 的 老板 ， 对 不 对 ？,他是你的老板，对不对？,tā shì nǐ de lǎobǎn ， dùi bù dùi ？,"He is your boss, right?",[sound:hsk2_grammar_sent779.mp3],:: Verb + 不 + Verb ::,"Asking questions, Giving alternatives","Tag questions with ""bu""",https://resources.allsetlearning.com/chinese/grammar/ASG4D8XB
我们 是 好 朋友 ， 对 不 对 ？,我们是好朋友，对不对？,wǒmen shì hǎo péngyǒu ， dùi bù dùi ？,"We are good friends, right?",[sound:hsk2_grammar_sent780.mp3],:: Verb + 不 + Verb ::,"Asking questions, Giving alternatives","Tag questions with ""bu""",https://resources.allsetlearning.com/chinese/grammar/ASG4D8XB
你 昨天 没 回家， 对 不 对 ？,你昨天没回家，对不对？,nǐ zuótiān méi húijiā， dùi bù dùi ？,"You did n’t go home yesterday, right?",[sound:hsk2_grammar_sent781.mp3],:: Verb + 不 + Verb ::,"Asking questions, Giving alternatives","Tag questions with ""bu""",https://resources.allsetlearning.com/chinese/grammar/ASG4D8XB
你 有 新 女朋友 了 ， 是 不 是 ？,你有新女朋友了，是不是？,nǐ yǒu xīn nv̌péngyǒu le ， shì bù shì ？,"You have a new girlfriend, aren't you?",[sound:hsk2_grammar_sent782.mp3],:: Verb + 不 + Verb ::,"Asking questions, Giving alternatives","Tag questions with ""bu""",https://resources.allsetlearning.com/chinese/grammar/ASG4D8XB
九 点 开会 ， 是 不 是 ？,九点开会，是不是？,jǐu diǎn kāihùi ， shì bù shì ？,"Meeting at nine, is n’t it?",[sound:hsk2_grammar_sent783.mp3],:: Verb + 不 + Verb ::,"Asking questions, Giving alternatives","Tag questions with ""bu""",https://resources.allsetlearning.com/chinese/grammar/ASG4D8XB
你 姓 王 ， 是 不 是 ？,你姓王，是不是？,nǐ xìng wáng ， shì bù shì ？,"Your surname is Wang, isn't it?",[sound:hsk2_grammar_sent784.mp3],:: Verb + 不 + Verb ::,"Asking questions, Giving alternatives","Tag questions with ""bu""",https://resources.allsetlearning.com/chinese/grammar/ASG4D8XB
我们 回家 吧 ， 好 不 好 ？,我们回家吧，好不好？,wǒmen húijiā ba ， hǎo bù hǎo ？,"Let's go home, shall we?",[sound:hsk2_grammar_sent785.mp3],:: Verb + 不 + Verb ::,"Asking questions, Giving alternatives","Tag questions with ""bu""",https://resources.allsetlearning.com/chinese/grammar/ASG4D8XB
周末 去 看 电影， 好 不 好 ？,周末去看电影，好不好？,zhōumò qù kàn diànyǐng， hǎo bù hǎo ？,"Go to the movies on the weekend, OK?",[sound:hsk2_grammar_sent786.mp3],:: Verb + 不 + Verb ::,"Asking questions, Giving alternatives","Tag questions with ""bu""",https://resources.allsetlearning.com/chinese/grammar/ASG4D8XB
你们 明天 来， 好 不 好 ？,你们明天来，好不好？,nǐmen míngtiān lái， hǎo bù hǎo ？,"You guys come tomorrow, okay?",[sound:hsk2_grammar_sent787.mp3],:: Verb + 不 + Verb ::,"Asking questions, Giving alternatives","Tag questions with ""bu""",https://resources.allsetlearning.com/chinese/grammar/ASG4D8XB
这样 做，对 吗 ？,这样做，对吗？,zhèyáng zuò，dùi ma ？,Is it right to do this?,[sound:hsk2_grammar_sent788.mp3],:: ⋯⋯， 好 / 对 / 是 / 可以 + 吗？ ::,"Asking questions, Requesting","Tag questions with ""ma""",https://resources.allsetlearning.com/chinese/grammar/ASGSJYZ2
你们 见 过，对 吗 ？,你们见过，对吗？,nǐmen jiàn guò，dùi ma ？,"Have you seen it, right?",[sound:hsk2_grammar_sent789.mp3],:: ⋯⋯， 好 / 对 / 是 / 可以 + 吗？ ::,"Asking questions, Requesting","Tag questions with ""ma""",https://resources.allsetlearning.com/chinese/grammar/ASGSJYZ2
他们 昨天 都 没 去， 是 吗 ？,他们昨天都没去，是吗？,tāmen zuótiān dū méi qù， shì ma ？,"They did n’t go yesterday, did they?",[sound:hsk2_grammar_sent790.mp3],:: ⋯⋯， 好 / 对 / 是 / 可以 + 吗？ ::,"Asking questions, Requesting","Tag questions with ""ma""",https://resources.allsetlearning.com/chinese/grammar/ASGSJYZ2
你 没 来 过， 是 吗 ？,你没来过，是吗？,nǐ méi lái guò， shì ma ？,"You haven't been here, have you?",[sound:hsk2_grammar_sent791.mp3],:: ⋯⋯， 好 / 对 / 是 / 可以 + 吗？ ::,"Asking questions, Requesting","Tag questions with ""ma""",https://resources.allsetlearning.com/chinese/grammar/ASGSJYZ2
你 喜欢 我妹妹， 是 吗 ？,你喜欢我妹妹，是吗？,nǐ xǐhuān wǒmèimèi， shì ma ？,"Do you like my sister, do you?",[sound:hsk2_grammar_sent792.mp3],:: ⋯⋯， 好 / 对 / 是 / 可以 + 吗？ ::,"Asking questions, Requesting","Tag questions with ""ma""",https://resources.allsetlearning.com/chinese/grammar/ASGSJYZ2
我们 去 你 家 ， 好 吗 ？,我们去你家，好吗？,wǒmen qù nǐ jiā ， hǎo ma ？,Shall we go to your house?,[sound:hsk2_grammar_sent793.mp3],:: ⋯⋯， 好 / 对 / 是 / 可以 + 吗？ ::,"Asking questions, Requesting","Tag questions with ""ma""",https://resources.allsetlearning.com/chinese/grammar/ASGSJYZ2
不要 告诉 他 ， 好 吗 ？,不要告诉他，好吗？,bùyào gàosù tā ， hǎo ma ？,"Do n’t tell him, okay?",[sound:hsk2_grammar_sent794.mp3],:: ⋯⋯， 好 / 对 / 是 / 可以 + 吗？ ::,"Asking questions, Requesting","Tag questions with ""ma""",https://resources.allsetlearning.com/chinese/grammar/ASGSJYZ2
今天 我们 都 不 喝酒， 好 吗 ？,今天我们都不喝酒，好吗？,jīntiān wǒmen dū bù hējǐu， hǎo ma ？,"We do n’t drink today, shall we?",[sound:hsk2_grammar_sent795.mp3],:: ⋯⋯， 好 / 对 / 是 / 可以 + 吗？ ::,"Asking questions, Requesting","Tag questions with ""ma""",https://resources.allsetlearning.com/chinese/grammar/ASGSJYZ2
我 现在 想 去 洗手间， 可以 吗 ？,我现在想去洗手间，可以吗？,wǒ xiànzài xiǎng qù xǐshǒujiān， kěyǐ ma ？,"I want to go to the bathroom now, can I?",[sound:hsk2_grammar_sent796.mp3],:: ⋯⋯， 好 / 对 / 是 / 可以 + 吗？ ::,"Asking questions, Requesting","Tag questions with ""ma""",https://resources.allsetlearning.com/chinese/grammar/ASGSJYZ2
妈妈，我 要 吃 巧克力 ， 可以 吗 ？,妈妈，我要吃巧克力，可以吗？,māmā，wǒ yào chī qiǎokèlì ， kěyǐ ma ？,"Mom, can I eat chocolate?",[sound:hsk2_grammar_sent797.mp3],:: ⋯⋯， 好 / 对 / 是 / 可以 + 吗？ ::,"Asking questions, Requesting","Tag questions with ""ma""",https://resources.allsetlearning.com/chinese/grammar/ASGSJYZ2
他 学 得 很 快 ，因为 他 很 聪明 。,他学得很快，因为他很聪明。,tā xué dé hěn kuài ，yīnwèi tā hěn cōngmíng 。,He learns quickly because he is very smart.,[sound:hsk2_grammar_sent798.mp3],":: Result, 因为 + Reason ::","Expressing result, Sequencing events in time, Indicating cause and effect","Cause and effect with ""yinwei"" and ""suoyi""",https://resources.allsetlearning.com/chinese/grammar/ASGTDUJO
我 爱 吃 四川 菜 ，因为 很 辣 。,我爱吃四川菜，因为很辣。,wǒ ài chī sìchuān cài ，yīnwèi hěn là 。,I love Sichuan food because it is very spicy.,[sound:hsk2_grammar_sent799.mp3],":: Result, 因为 + Reason ::","Expressing result, Sequencing events in time, Indicating cause and effect","Cause and effect with ""yinwei"" and ""suoyi""",https://resources.allsetlearning.com/chinese/grammar/ASGTDUJO
我 在 学习 中文 ，因为 我 想 去 中国 。,我在学习中文，因为我想去中国。,wǒ zài xuéxí zhōngwén ，yīnwèi wǒ xiǎng qù zhōngguó 。,I am learning Chinese because I want to go to China.,[sound:hsk2_grammar_sent800.mp3],":: Result, 因为 + Reason ::","Expressing result, Sequencing events in time, Indicating cause and effect","Cause and effect with ""yinwei"" and ""suoyi""",https://resources.allsetlearning.com/chinese/grammar/ASGTDUJO
我 不 喜欢 她 ，因为 她 不 友好 。,我不喜欢她，因为她不友好。,wǒ bù xǐhuān tā ，yīnwèi tā bù yǒuhǎo 。,I don't like her because she is not friendly.,[sound:hsk2_grammar_sent801.mp3],":: Result, 因为 + Reason ::","Expressing result, Sequencing events in time, Indicating cause and effect","Cause and effect with ""yinwei"" and ""suoyi""",https://resources.allsetlearning.com/chinese/grammar/ASGTDUJO
今天 我们 很 忙 ，因为 有 很 多 工作 。,今天我们很忙，因为有很多工作。,jīntiān wǒmen hěn máng ，yīnwèi yǒu hěn duō gōngzuò 。,Today we are very busy because there is a lot of work.,[sound:hsk2_grammar_sent802.mp3],":: Result, 因为 + Reason ::","Expressing result, Sequencing events in time, Indicating cause and effect","Cause and effect with ""yinwei"" and ""suoyi""",https://resources.allsetlearning.com/chinese/grammar/ASGTDUJO
汉字 太 难 了，所以 我 不 想 学 。,汉字太难了，所以我不想学。,hànzì tài nán le，suǒyǐ wǒ bù xiǎng xué 。,"Chinese characters are too difficult, so I don't want to learn.",[sound:hsk2_grammar_sent803.mp3],":: Reason, 所以 + Result ::","Expressing result, Sequencing events in time, Indicating cause and effect","Cause and effect with ""yinwei"" and ""suoyi""",https://resources.allsetlearning.com/chinese/grammar/ASGTDUJO
她 很 漂亮，所以 很 多 男孩 喜欢 她 。,她很漂亮，所以很多男孩喜欢她。,tā hěn piāoliàng，suǒyǐ hěn duō nánhái xǐhuān tā 。,"She is very beautiful, so many boys like her.",[sound:hsk2_grammar_sent804.mp3],":: Reason, 所以 + Result ::","Expressing result, Sequencing events in time, Indicating cause and effect","Cause and effect with ""yinwei"" and ""suoyi""",https://resources.allsetlearning.com/chinese/grammar/ASGTDUJO
他 找到 工作 了， 所以 很 高兴 。,他找到工作了，所以很高兴。,tā zhǎodào gōngzuò le， suǒyǐ hěn gāoxīng 。,"He found a job, so he was very happy.",[sound:hsk2_grammar_sent805.mp3],":: Reason, 所以 + Result ::","Expressing result, Sequencing events in time, Indicating cause and effect","Cause and effect with ""yinwei"" and ""suoyi""",https://resources.allsetlearning.com/chinese/grammar/ASGTDUJO
我 太 忙 了，所以 没有 时间 给 你 打 电话 。,我太忙了，所以没有时间给你打电话。,wǒ tài máng le，suǒyǐ méiyǒu shíjiān gěi nǐ dǎ diànhuà 。,"I'm too busy, so I don't have time to call you.",[sound:hsk2_grammar_sent806.mp3],":: Reason, 所以 + Result ::","Expressing result, Sequencing events in time, Indicating cause and effect","Cause and effect with ""yinwei"" and ""suoyi""",https://resources.allsetlearning.com/chinese/grammar/ASGTDUJO
我们 公司 有 很 多 外国人，所以 我们 要 说 英文 。,我们公司有很多外国人，所以我们要说英文。,wǒmen gōngsī yǒu hěn duō wàiguórén，suǒyǐ wǒmen yào shuō yīngwén 。,"Our company has many foreigners, so we have to speak English.",[sound:hsk2_grammar_sent807.mp3],":: Reason, 所以 + Result ::","Expressing result, Sequencing events in time, Indicating cause and effect","Cause and effect with ""yinwei"" and ""suoyi""",https://resources.allsetlearning.com/chinese/grammar/ASGTDUJO
因为 我 有 一个 中国 女朋友，所以 我 要 学 中文 。,因为我有一个中国女朋友，所以我要学中文。,yīnwèi wǒ yǒu yīgè zhōngguó nv̌péngyǒu，suǒyǐ wǒ yào xué zhōngwén 。,"Because I have a Chinese girlfriend, I want to learn Chinese.",[sound:hsk2_grammar_sent808.mp3],":: 因为 + Cause, 所以 + Effect ::","Expressing result, Sequencing events in time, Indicating cause and effect","Cause and effect with ""yinwei"" and ""suoyi""",https://resources.allsetlearning.com/chinese/grammar/ASGTDUJO
因为 他 生病 了，所以 没 去 上课 。,因为他生病了，所以没去上课。,yīnwèi tā shēngbìng le，suǒyǐ méi qù shàngkè 。,"Because he was ill, he didn't go to class.",[sound:hsk2_grammar_sent809.mp3],":: 因为 + Cause, 所以 + Effect ::","Expressing result, Sequencing events in time, Indicating cause and effect","Cause and effect with ""yinwei"" and ""suoyi""",https://resources.allsetlearning.com/chinese/grammar/ASGTDUJO
因为 我 很 累，所以 要 休息 。,因为我很累，所以要休息。,yīnwèi wǒ hěn lèi，suǒyǐ yào xīuxī 。,"Because I am tired, I have to rest.",[sound:hsk2_grammar_sent810.mp3],":: 因为 + Cause, 所以 + Effect ::","Expressing result, Sequencing events in time, Indicating cause and effect","Cause and effect with ""yinwei"" and ""suoyi""",https://resources.allsetlearning.com/chinese/grammar/ASGTDUJO
因为 太 远 了，所以 我 不 想 去 。,因为太远了，所以我不想去。,yīnwèi tài yuǎn le，suǒyǐ wǒ bù xiǎng qù 。,"Because it's too far, I don't want to go.",[sound:hsk2_grammar_sent811.mp3],":: 因为 + Cause, 所以 + Effect ::","Expressing result, Sequencing events in time, Indicating cause and effect","Cause and effect with ""yinwei"" and ""suoyi""",https://resources.allsetlearning.com/chinese/grammar/ASGTDUJO
因为 太 忙， 所以 我们 没有 时间 吃 中饭 。,因为太忙，所以我们没有时间吃中饭。,yīnwèi tài máng， suǒyǐ wǒmen méiyǒu shíjiān chī zhōngfàn 。,"Because we are too busy, we have no time for lunch.",[sound:hsk2_grammar_sent812.mp3],":: 因为 + Cause, 所以 + Effect ::","Expressing result, Sequencing events in time, Indicating cause and effect","Cause and effect with ""yinwei"" and ""suoyi""",https://resources.allsetlearning.com/chinese/grammar/ASGTDUJO
