妈妈 做 的,妈妈做的,māmā zuò de,Made by mother,[sound:hsk2_grammar_sent217.mp3],:: Phrase + 的 + （Noun） ::,"Describing actions, Describing people, Describing things, Describing places, Expressing quality","Modifying nouns with phrase + ""de""",https://resources.allsetlearning.com/chinese/grammar/ASGLQKD12
我 画 的,我画的,wǒ huà de,I drew it,[sound:hsk2_grammar_sent218.mp3],:: Phrase + 的 + （Noun） ::,"Describing actions, Describing people, Describing things, Describing places, Expressing quality","Modifying nouns with phrase + ""de""",https://resources.allsetlearning.com/chinese/grammar/ASGLQKD13
他 写 的,他写的,tā xiě de,He wrote,[sound:hsk2_grammar_sent219.mp3],:: Phrase + 的 + （Noun） ::,"Describing actions, Describing people, Describing things, Describing places, Expressing quality","Modifying nouns with phrase + ""de""",https://resources.allsetlearning.com/chinese/grammar/ASGLQKD14
你 教 的,你教的,nǐ jiào de,What you taught,[sound:hsk2_grammar_sent220.mp3],:: Phrase + 的 + （Noun） ::,"Describing actions, Describing people, Describing things, Describing places, Expressing quality","Modifying nouns with phrase + ""de""",https://resources.allsetlearning.com/chinese/grammar/ASGLQKD15
哪 个 老师 最 好 ？,哪个老师最好？,nǎ gè lǎoshī zùi hǎo ？,Which teacher is the best?,[sound:hsk2_grammar_sent221.mp3],:: 最 + Adj. ::,"Comparing, Emphasizing","Superlative ""zui""",https://resources.allsetlearning.com/chinese/grammar/ASG3544U
你们 家 谁 最 漂亮 ？,你们家谁最漂亮？,nǐmen jiā shúi zùi piāoliàng ？,Who is the most beautiful in your family?,[sound:hsk2_grammar_sent222.mp3],:: 最 + Adj. ::,"Comparing, Emphasizing","Superlative ""zui""",https://resources.allsetlearning.com/chinese/grammar/ASG3544U
谁 最 有钱 ？,谁最有钱？,shúi zùi yǒuqián ？,Who is the richest?,[sound:hsk2_grammar_sent223.mp3],:: 最 + Adj. ::,"Comparing, Emphasizing","Superlative ""zui""",https://resources.allsetlearning.com/chinese/grammar/ASG3544U
汉语 最 难 。,汉语最难。,hànyǔ zùi nán 。,Chinese is the hardest.,[sound:hsk2_grammar_sent224.mp3],:: 最 + Adj. ::,"Comparing, Emphasizing","Superlative ""zui""",https://resources.allsetlearning.com/chinese/grammar/ASG3544U
这 种 事 最 麻烦 。,这种事最麻烦。,zhè zhǒng shì zùi máfán 。,This kind of thing is the most troublesome.,[sound:hsk2_grammar_sent225.mp3],:: 最 + Adj. ::,"Comparing, Emphasizing","Superlative ""zui""",https://resources.allsetlearning.com/chinese/grammar/ASG3544U
小狗 最 可爱 了 。,小狗最可爱了。,xiǎogǒu zùi kěài le 。,The puppy is the cutest.,[sound:hsk2_grammar_sent226.mp3],:: 最 + Adj. (+ 了) ::,"Comparing, Emphasizing","Superlative ""zui""",https://resources.allsetlearning.com/chinese/grammar/ASG3544U
四川 菜 最 辣 了 。,四川菜最辣了。,sìchuān cài zùi là le 。,Sichuan food is the hottest.,[sound:hsk2_grammar_sent227.mp3],:: 最 + Adj. (+ 了) ::,"Comparing, Emphasizing","Superlative ""zui""",https://resources.allsetlearning.com/chinese/grammar/ASG3544U
我 的 中国 朋友 最 热情 了 。,我的中国朋友最热情了。,wǒ de zhōngguó péngyǒu zùi rèqíng le 。,My Chinese friends are the most enthusiastic.,[sound:hsk2_grammar_sent228.mp3],:: 最 + Adj. (+ 了) ::,"Comparing, Emphasizing","Superlative ""zui""",https://resources.allsetlearning.com/chinese/grammar/ASG3544U
他 的 学生 最 认真 了 。,他的学生最认真了。,tā de xuéshēng zùi rènzhēn le 。,His students are the most serious.,[sound:hsk2_grammar_sent229.mp3],:: 最 + Adj. (+ 了) ::,"Comparing, Emphasizing","Superlative ""zui""",https://resources.allsetlearning.com/chinese/grammar/ASG3544U
黄山 的 风景 最 美 了 。,黄山的风景最美了。,huángshān de fēngjǐng zùi měi le 。,The scenery of Huangshan is the most beautiful.,[sound:hsk2_grammar_sent230.mp3],:: 最 + Adj. (+ 了) ::,"Comparing, Emphasizing","Superlative ""zui""",https://resources.allsetlearning.com/chinese/grammar/ASG3544U
老板 最 喜欢 你 了！,老板最喜欢你了！,lǎobǎn zùi xǐhuān nǐ le！,The boss likes you the most!,[sound:hsk2_grammar_sent231.mp3],:: 最 + [Psychological Verb] + Obj. (+ 了) ::,"Comparing, Emphasizing","Superlative ""zui""",https://resources.allsetlearning.com/chinese/grammar/ASG3544U
你 最 怕 什么 ？,你最怕什么？,nǐ zùi pà shíyāo ？,What are you most afraid of?,[sound:hsk2_grammar_sent232.mp3],:: 最 + [Psychological Verb] + Obj. (+ 了) ::,"Comparing, Emphasizing","Superlative ""zui""",https://resources.allsetlearning.com/chinese/grammar/ASG3544U
我 最 爱 中国 菜 。,我最爱中国菜。,wǒ zùi ài zhōngguó cài 。,I love Chinese food the most.,[sound:hsk2_grammar_sent233.mp3],:: 最 + [Psychological Verb] + Obj. (+ 了) ::,"Comparing, Emphasizing","Superlative ""zui""",https://resources.allsetlearning.com/chinese/grammar/ASG3544U
谁 最 了解 你 ？,谁最了解你？,shúi zùi lejiě nǐ ？,Who knows you best?,[sound:hsk2_grammar_sent234.mp3],:: 最 + [Psychological Verb] + Obj. (+ 了) ::,"Comparing, Emphasizing","Superlative ""zui""",https://resources.allsetlearning.com/chinese/grammar/ASG3544U
她 最 讨厌 抽烟 的 男人 了 。,她最讨厌抽烟的男人了。,tā zùi tǎoyàn chōuyān de nánrén le 。,She hates smoking men the most.,[sound:hsk2_grammar_sent235.mp3],:: 最 + [Psychological Verb] + Obj. (+ 了) ::,"Comparing, Emphasizing","Superlative ""zui""",https://resources.allsetlearning.com/chinese/grammar/ASG3544U
你 最 喜欢 什么 颜色 ？,你最喜欢什么颜色？,nǐ zùi xǐhuān shíyāo yánsè ？,What is your favorite color?,[sound:hsk2_grammar_sent236.mp3],:: 最 + [Psychological Verb] + Obj. (+ 了) ::,"Comparing, Emphasizing","Superlative ""zui""",https://resources.allsetlearning.com/chinese/grammar/ASG3544U
你 最 喜欢 什么 动物 ？,你最喜欢什么动物？,nǐ zùi xǐhuān shíyāo dòngwù ？,What is your favorite animal?,[sound:hsk2_grammar_sent237.mp3],:: 最 + [Psychological Verb] + Obj. (+ 了) ::,"Comparing, Emphasizing","Superlative ""zui""",https://resources.allsetlearning.com/chinese/grammar/ASG3544U
那个 ⋯⋯ 我 不 跟 你们 一起 去 了，可以 吗 ？,那个⋯⋯我不跟你们一起去了，可以吗？,nàgè ⋯⋯ wǒ bù gēn nǐmen yīqǐ qù le，kěyǐ ma ？,"That ... I won't go with you anymore, is it okay?",[sound:hsk2_grammar_sent238.mp3],:: (那个⋯⋯) (那个⋯⋯) + [anything] + (那个⋯⋯) ::,Connecting ideas,"The filler word ""neige""",https://resources.allsetlearning.com/chinese/grammar/ASG8VJM8
我 想 吃 那个 ⋯⋯ 那个 ⋯⋯ 湖南 菜 。,我想吃那个⋯⋯那个⋯⋯湖南菜。,wǒ xiǎng chī nàgè ⋯⋯ nàgè ⋯⋯ húnán cài 。,I want to eat that ⋯⋯ that ⋯⋯ Hunan cuisine.,[sound:hsk2_grammar_sent239.mp3],:: (那个⋯⋯) (那个⋯⋯) + [anything] + (那个⋯⋯) ::,Connecting ideas,"The filler word ""neige""",https://resources.allsetlearning.com/chinese/grammar/ASG8VJM8
那个 ⋯⋯ 我 明天 不 来 了 。,那个⋯⋯我明天不来了。,nàgè ⋯⋯ wǒ míngtiān bù lái le 。,That ... I will not come tomorrow.,[sound:hsk2_grammar_sent240.mp3],:: (那个⋯⋯) (那个⋯⋯) + [anything] + (那个⋯⋯) ::,Connecting ideas,"The filler word ""neige""",https://resources.allsetlearning.com/chinese/grammar/ASG8VJM8
那个 ⋯⋯ 这样 做 不 好 吧 ？,那个⋯⋯这样做不好吧？,nàgè ⋯⋯ zhèyáng zuò bù hǎo ba ？,Is that ⋯⋯ bad?,[sound:hsk2_grammar_sent241.mp3],:: (那个⋯⋯) (那个⋯⋯) + [anything] + (那个⋯⋯) ::,Connecting ideas,"The filler word ""neige""",https://resources.allsetlearning.com/chinese/grammar/ASG8VJM8
那个 ⋯⋯ 你 可以 做 我 的 女 朋友 吗 ？,那个⋯⋯你可以做我的女朋友吗？,nàgè ⋯⋯ nǐ kěyǐ zuò wǒ de nv̌ péngyǒu ma ？,That ... Can you be my girlfriend?,[sound:hsk2_grammar_sent242.mp3],:: (那个⋯⋯) (那个⋯⋯) + [anything] + (那个⋯⋯) ::,Connecting ideas,"The filler word ""neige""",https://resources.allsetlearning.com/chinese/grammar/ASG8VJM8
那个 ⋯⋯ 不好意思 ， 我 要 走 了 。,那个⋯⋯不好意思，我要走了。,nàgè ⋯⋯ bùhǎoyìsī ， wǒ yào zǒu le 。,"That ... I'm sorry, I'm leaving.",[sound:hsk2_grammar_sent243.mp3],:: (那个⋯⋯) (那个⋯⋯) + [anything] + (那个⋯⋯) ::,Connecting ideas,"The filler word ""neige""",https://resources.allsetlearning.com/chinese/grammar/ASG8VJM8
她 很 漂亮 ， 就 像 那个 ⋯⋯ 明星 一样 。,她很漂亮，就像那个⋯⋯明星一样。,tā hěn piāoliàng ， jìu xiàng nàgè ⋯⋯ míngxīng yīyáng 。,"She is very beautiful, just like that ⋯⋯ star.",[sound:hsk2_grammar_sent244.mp3],:: (那个⋯⋯) (那个⋯⋯) + [anything] + (那个⋯⋯) ::,Connecting ideas,"The filler word ""neige""",https://resources.allsetlearning.com/chinese/grammar/ASG8VJM8
我 想 看看 你 买 的 那个 ⋯⋯ 那个 ⋯⋯ iPhone 。,我想看看你买的那个⋯⋯那个⋯⋯iPhone。,wǒ xiǎng kànkàn nǐ mǎi de nàgè ⋯⋯ nàgè ⋯⋯ iPhone 。,I want to see the ⋯⋯ that ⋯⋯ iPhone you bought.,[sound:hsk2_grammar_sent245.mp3],:: (那个⋯⋯) (那个⋯⋯) + [anything] + (那个⋯⋯) ::,Connecting ideas,"The filler word ""neige""",https://resources.allsetlearning.com/chinese/grammar/ASG8VJM8
那个 ⋯⋯ 我 要 去 开会 了 。,那个⋯⋯我要去开会了。,nàgè ⋯⋯ wǒ yào qù kāihùi le 。,That ... I'm going to the meeting.,[sound:hsk2_grammar_sent246.mp3],:: (那个⋯⋯) (那个⋯⋯) + [anything] + (那个⋯⋯) ::,Connecting ideas,"The filler word ""neige""",https://resources.allsetlearning.com/chinese/grammar/ASG8VJM8
昨天 那个 ⋯⋯ 那个 ⋯⋯ 小笼包 真 好吃 。,昨天那个⋯⋯那个⋯⋯小笼包真好吃。,zuótiān nàgè ⋯⋯ nàgè ⋯⋯ xiǎolóngbāo zhēn hǎochī 。,Yesterday that ⋯⋯ that ⋯⋯ Xiao Long Bao was so delicious.,[sound:hsk2_grammar_sent247.mp3],:: (那个⋯⋯) (那个⋯⋯) + [anything] + (那个⋯⋯) ::,Connecting ideas,"The filler word ""neige""",https://resources.allsetlearning.com/chinese/grammar/ASG8VJM8
公司 的 员工 个 个 都 很 好 。,公司的员工个个都很好。,gōngsī de yuángōng gè gè dū hěn hǎo 。,Everyone in the company is very good.,[sound:hsk2_grammar_sent248.mp3],:: Subj + MW + MW + Predicate ::,Expressing quantity,Reduplication of measure words,https://resources.allsetlearning.com/chinese/grammar/ASG6120A
他们 个 个 都 不 喜欢 打 游戏 。,他们个个都不喜欢打游戏。,tāmen gè gè dū bù xǐhuān dǎ yóuxì 。,None of them like playing games.,[sound:hsk2_grammar_sent249.mp3],:: Subj + MW + MW + Predicate ::,Expressing quantity,Reduplication of measure words,https://resources.allsetlearning.com/chinese/grammar/ASG6120A
这个 星期 他 天 天 给 我 打 电话 。,这个星期他天天给我打电话。,zhègè xīngqī tā tiān tiān gěi wǒ dǎ diànhuà 。,He called me every day this week.,[sound:hsk2_grammar_sent250.mp3],:: Subj + MW + MW + Predicate ::,Expressing quantity,Reduplication of measure words,https://resources.allsetlearning.com/chinese/grammar/ASG6120A
我 天 天 走路 去 公司 。,我天天走路去公司。,wǒ tiān tiān zǒulù qù gōngsī 。,I walk to the company every day.,[sound:hsk2_grammar_sent251.mp3],:: Subj + MW + MW + Predicate ::,Expressing quantity,Reduplication of measure words,https://resources.allsetlearning.com/chinese/grammar/ASG6120A
现在 家 家 都 有 手机 。,现在家家都有手机。,xiànzài jiā jiā dū yǒu shǒujī 。,Everyone now has a mobile phone.,[sound:hsk2_grammar_sent252.mp3],:: Subj + MW + MW + Predicate ::,Expressing quantity,Reduplication of measure words,https://resources.allsetlearning.com/chinese/grammar/ASG6120A
这里 的 公司 家 家 都 用 苹果 电脑 。,这里的公司家家都用苹果电脑。,zhèlǐ de gōngsī jiā jiā dū yòng píngguǒ diànnǎo 。,All the companies here use Apple computers.,[sound:hsk2_grammar_sent253.mp3],:: Subj + MW + MW + Predicate ::,Expressing quantity,Reduplication of measure words,https://resources.allsetlearning.com/chinese/grammar/ASG6120A
我 的 衣服 件 件 都 很 好看 。,我的衣服件件都很好看。,wǒ de yīfú jiàn jiàn dū hěn hǎokàn 。,My clothes are beautiful.,[sound:hsk2_grammar_sent254.mp3],:: Subj + MW + MW + Predicate ::,Expressing quantity,Reduplication of measure words,https://resources.allsetlearning.com/chinese/grammar/ASG6120A
这 家 店 的 书 本 本 都 很 贵 。,这家店的书本本都很贵。,zhè jiā diàn de shū běn běn dū hěn gùi 。,The books in this shop are very expensive.,[sound:hsk2_grammar_sent255.mp3],:: Subj + MW + MW + Predicate ::,Expressing quantity,Reduplication of measure words,https://resources.allsetlearning.com/chinese/grammar/ASG6120A
她 次 次 都 打车 来 。,她次次都打车来。,tā cì cì dū dǎchē lái 。,She called every time.,[sound:hsk2_grammar_sent256.mp3],:: Subj + MW + MW + Predicate ::,Expressing quantity,Reduplication of measure words,https://resources.allsetlearning.com/chinese/grammar/ASG6120A
这些 小狗 只 只 都 很 可爱 。,这些小狗只只都很可爱。,zhèxiē xiǎogǒu zhǐ zhǐ dū hěn kěài 。,These puppies are very cute.,[sound:hsk2_grammar_sent257.mp3],:: Subj + MW + MW + Predicate ::,Expressing quantity,Reduplication of measure words,https://resources.allsetlearning.com/chinese/grammar/ASG6120A
你 不 在 的时候，我 会 想 你 。,你不在的时候，我会想你。,nǐ bù zài deshíhòu，wǒ hùi xiǎng nǐ 。,I will miss you when you are away.,[sound:hsk2_grammar_sent258.mp3],":: Time Word + 的 时候, .... ::/:: (Subj.) + Verb / Adj. + 的 时候, .... ::","Referring to simultaneous events, Expressing time and date","Expressing ""when"" with ""de shihou""",https://resources.allsetlearning.com/chinese/grammar/ASGWN185
我 上 大学 的时候，有 很 多 朋友 。,我上大学的时候，有很多朋友。,wǒ shàng dàxué deshíhòu，yǒu hěn duō péngyǒu 。,"When I was in college, I had many friends.",[sound:hsk2_grammar_sent259.mp3],":: Time Word + 的 时候, .... ::/:: (Subj.) + Verb / Adj. + 的 时候, .... ::","Referring to simultaneous events, Expressing time and date","Expressing ""when"" with ""de shihou""",https://resources.allsetlearning.com/chinese/grammar/ASGWN185
上课 的时候 不要 吃 东西 。,上课的时候不要吃东西。,shàngkè deshíhòu bùyào chī dōngxī 。,Don't eat during class.,[sound:hsk2_grammar_sent260.mp3],":: Time Word + 的 时候, .... ::/:: (Subj.) + Verb / Adj. + 的 时候, .... ::","Referring to simultaneous events, Expressing time and date","Expressing ""when"" with ""de shihou""",https://resources.allsetlearning.com/chinese/grammar/ASGWN185
老板 工作 的时候 喜欢 喝 咖啡 。,老板工作的时候喜欢喝咖啡。,lǎobǎn gōngzuò deshíhòu xǐhuān hē kāfēi 。,The boss likes coffee while working.,[sound:hsk2_grammar_sent261.mp3],":: Time Word + 的 时候, .... ::/:: (Subj.) + Verb / Adj. + 的 时候, .... ::","Referring to simultaneous events, Expressing time and date","Expressing ""when"" with ""de shihou""",https://resources.allsetlearning.com/chinese/grammar/ASGWN185
我 生气 的时候，请 你 不要 笑 。,我生气的时候，请你不要笑。,wǒ shēngqì deshíhòu，qǐng nǐ bùyào xiào 。,"When I'm angry, please don't laugh.",[sound:hsk2_grammar_sent262.mp3],":: Time Word + 的 时候, .... ::/:: (Subj.) + Verb / Adj. + 的 时候, .... ::","Referring to simultaneous events, Expressing time and date","Expressing ""when"" with ""de shihou""",https://resources.allsetlearning.com/chinese/grammar/ASGWN185
妈妈 不 在 家 的时候，我 自己 做饭 。,妈妈不在家的时候，我自己做饭。,māmā bù zài jiā deshíhòu，wǒ zìjǐ zuòfàn 。,"When my mother is not at home, I cook for myself.",[sound:hsk2_grammar_sent263.mp3],":: Time Word + 的 时候, .... ::/:: (Subj.) + Verb / Adj. + 的 时候, .... ::","Referring to simultaneous events, Expressing time and date","Expressing ""when"" with ""de shihou""",https://resources.allsetlearning.com/chinese/grammar/ASGWN185
开会 的时候 不要 聊天 。,开会的时候不要聊天。,kāihùi deshíhòu bùyào liáotiān 。,Don't chat during meetings.,[sound:hsk2_grammar_sent264.mp3],":: Time Word + 的 时候, .... ::/:: (Subj.) + Verb / Adj. + 的 时候, .... ::","Referring to simultaneous events, Expressing time and date","Expressing ""when"" with ""de shihou""",https://resources.allsetlearning.com/chinese/grammar/ASGWN185
吃 东西 的时候 不要 说话 。,吃东西的时候不要说话。,chī dōngxī deshíhòu bùyào shuōhuà 。,Don't talk while eating.,[sound:hsk2_grammar_sent265.mp3],":: Time Word + 的 时候, .... ::/:: (Subj.) + Verb / Adj. + 的 时候, .... ::","Referring to simultaneous events, Expressing time and date","Expressing ""when"" with ""de shihou""",https://resources.allsetlearning.com/chinese/grammar/ASGWN185
你 开车 的时候 会 打 电话 吗 ？,你开车的时候会打电话吗？,nǐ kāichē deshíhòu hùi dǎ diànhuà ma ？,Do you call when you drive?,[sound:hsk2_grammar_sent266.mp3],":: Time Word + 的 时候, .... ::/:: (Subj.) + Verb / Adj. + 的 时候, .... ::","Referring to simultaneous events, Expressing time and date","Expressing ""when"" with ""de shihou""",https://resources.allsetlearning.com/chinese/grammar/ASGWN185
走路 的时候 不要 玩手机 。,走路的时候不要玩手机。,zǒulù deshíhòu bùyào wánshǒujī 。,Don't play with your mobile phone while walking.,[sound:hsk2_grammar_sent267.mp3],":: Time Word + 的 时候, .... ::/:: (Subj.) + Verb / Adj. + 的 时候, .... ::","Referring to simultaneous events, Expressing time and date","Expressing ""when"" with ""de shihou""",https://resources.allsetlearning.com/chinese/grammar/ASGWN185
我 妈妈 已经 五十 多 岁 了 。,我妈妈已经五十多岁了。,wǒ māmā yǐjīng wǔshí duō sùi le 。,My mother is over fifty years old.,[sound:hsk2_grammar_sent268.mp3],:: Number + 多 + [Measure word] (+ Noun) ::,Expressing quantity,Indicating a number in excess,https://resources.allsetlearning.com/chinese/grammar/ASG004ZK
我们 走 了 两 个 多 小时 。,我们走了两个多小时。,wǒmen zǒu le liǎng gè duō xiǎoshí 。,We walked for more than two hours.,[sound:hsk2_grammar_sent269.mp3],:: Number + 多 + [Measure word] (+ Noun) ::,Expressing quantity,Indicating a number in excess,https://resources.allsetlearning.com/chinese/grammar/ASG004ZK
这个 班 有 两 百 多 个 学生 。,这个班有两百多个学生。,zhègè bān yǒu liǎng bǎi duō gè xuéshēng 。,There are more than 200 students in this class.,[sound:hsk2_grammar_sent270.mp3],:: Number + 多 + [Measure word] (+ Noun) ::,Expressing quantity,Indicating a number in excess,https://resources.allsetlearning.com/chinese/grammar/ASG004ZK
这个 包 三 万 多 块钱 。,这个包三万多块钱。,zhègè bāo sān wàn duō kuàiqián 。,"This pack costs more than 30,000 yuan.",[sound:hsk2_grammar_sent271.mp3],:: Number + 多 + [Measure word] (+ Noun) ::,Expressing quantity,Indicating a number in excess,https://resources.allsetlearning.com/chinese/grammar/ASG004ZK
这 本 书 有 一 千 多 页 。,这本书有一千多页。,zhè běn shū yǒu yī qiān duō yè 。,This book has more than a thousand pages.,[sound:hsk2_grammar_sent272.mp3],:: Number + 多 + [Measure word] (+ Noun) ::,Expressing quantity,Indicating a number in excess,https://resources.allsetlearning.com/chinese/grammar/ASG004ZK
他 在 国外 住 了 二十 多 年 了 。,他在国外住了二十多年了。,tā zài guówài zhù le èrshí duō nián le 。,He has lived abroad for more than twenty years.,[sound:hsk2_grammar_sent273.mp3],:: Number + 多 + [Measure word] (+ Noun) ::,Expressing quantity,Indicating a number in excess,https://resources.allsetlearning.com/chinese/grammar/ASG004ZK
他 在 那儿 住 了 二十 多 天 了 。,他在那儿住了二十多天了。,tā zài nàér zhù le èrshí duō tiān le 。,He has lived there for more than twenty days.,[sound:hsk2_grammar_sent274.mp3],:: Number + 多 + [Measure word] (+ Noun) ::,Expressing quantity,Indicating a number in excess,https://resources.allsetlearning.com/chinese/grammar/ASG004ZK
我 昨天 收到 了 三十 多 条 垃圾 短信 。,我昨天收到了三十多条垃圾短信。,wǒ zuótiān shōudào le sānshí duō tiáo lājí duǎnxìn 。,I received more than 30 spam messages yesterday.,[sound:hsk2_grammar_sent275.mp3],:: Number + 多 + [Measure word] (+ Noun) ::,Expressing quantity,Indicating a number in excess,https://resources.allsetlearning.com/chinese/grammar/ASG004ZK
这个 城市 有 两 千 多 年 的 历史 。,这个城市有两千多年的历史。,zhègè chéngshì yǒu liǎng qiān duō nián de lìshǐ 。,This city has a history of more than two thousand years.,[sound:hsk2_grammar_sent276.mp3],:: Number + 多 + [Measure word] (+ Noun) ::,Expressing quantity,Indicating a number in excess,https://resources.allsetlearning.com/chinese/grammar/ASG004ZK
桌子 上 有 几 本 书 。,桌子上有几本书。,zhuōzǐ shàng yǒu jī běn shū 。,There are several books on the table.,[sound:hsk2_grammar_sent277.mp3],:: 几 + Measure Word + Noun ::,Expressing quantity,"Using ""ji"" to mean ""several""",https://resources.allsetlearning.com/chinese/grammar/ASGHC9CA
只有 几 个 人 去 过 那 个 地方 。,只有几个人去过那个地方。,zhǐyǒu jī gè rén qù guò nà gè dìfāng 。,Only a few people have been to that place.,[sound:hsk2_grammar_sent278.mp3],:: 几 + Measure Word + Noun ::,Expressing quantity,"Using ""ji"" to mean ""several""",https://resources.allsetlearning.com/chinese/grammar/ASGHC9CA
从 上海 到 东京 坐 飞机 只 要 几 个 小时 。,从上海到东京坐飞机只要几个小时。,cóng shànghǎi dào dōngjīng zuò fēijī zhǐ yào jī gè xiǎoshí 。,It only takes a few hours to fly from Shanghai to Tokyo.,[sound:hsk2_grammar_sent279.mp3],:: 几 + Measure Word + Noun ::,Expressing quantity,"Using ""ji"" to mean ""several""",https://resources.allsetlearning.com/chinese/grammar/ASGHC9CA
我 每 天 都 要 喝 几 杯 咖啡 。,我每天都要喝几杯咖啡。,wǒ měi tiān dū yào hē jī bēi kāfēi 。,I drink a few cups of coffee every day.,[sound:hsk2_grammar_sent280.mp3],:: 几 + Measure Word + Noun ::,Expressing quantity,"Using ""ji"" to mean ""several""",https://resources.allsetlearning.com/chinese/grammar/ASGHC9CA
老板 今天 开 了 几 个 重要 的 会 。,老板今天开了几个重要的会。,lǎobǎn jīntiān kāi le jī gè zhòngyào de hùi 。,The boss held several important meetings today.,[sound:hsk2_grammar_sent281.mp3],:: 几 + Measure Word + Noun ::,Expressing quantity,"Using ""ji"" to mean ""several""",https://resources.allsetlearning.com/chinese/grammar/ASGHC9CA
他 只 想 学 几 十 个 汉字 。,他只想学几十个汉字。,tā zhǐ xiǎng xué jī shí gè hànzì 。,He just wanted to learn dozens of Chinese characters.,[sound:hsk2_grammar_sent282.mp3],:: 几 + 十 + Measure Word + Noun ::,Expressing quantity,"Using ""ji"" to mean ""several""",https://resources.allsetlearning.com/chinese/grammar/ASGHC9CA
我们 公司 有 几 十 个 员工 。,我们公司有几十个员工。,wǒmen gōngsī yǒu jī shí gè yuángōng 。,Our company has dozens of employees.,[sound:hsk2_grammar_sent283.mp3],:: 几 + 十 + Measure Word + Noun ::,Expressing quantity,"Using ""ji"" to mean ""several""",https://resources.allsetlearning.com/chinese/grammar/ASGHC9CA
他 写 过 几 十 本 书，我 都 喜欢 。,他写过几十本书，我都喜欢。,tā xiě guò jī shí běn shū，wǒ dū xǐhuān 。,"He has written dozens of books, and I like them all.",[sound:hsk2_grammar_sent284.mp3],:: 几 + 十 + Measure Word + Noun ::,Expressing quantity,"Using ""ji"" to mean ""several""",https://resources.allsetlearning.com/chinese/grammar/ASGHC9CA
这个 年轻的 演员 演 了 几 十 部 电影 。,这个年轻的演员演了几十部电影。,zhègè niánqīngde yǎnyuán yǎn le jī shí bù diànyǐng 。,The young actor played dozens of movies.,[sound:hsk2_grammar_sent285.mp3],:: 几 + 十 + Measure Word + Noun ::,Expressing quantity,"Using ""ji"" to mean ""several""",https://resources.allsetlearning.com/chinese/grammar/ASGHC9CA
老板 在 国外 有 几 十 套 房子 。,老板在国外有几十套房子。,lǎobǎn zài guówài yǒu jī shí tào fángzǐ 。,The boss has dozens of houses abroad.,[sound:hsk2_grammar_sent286.mp3],:: 几 + 十 + Measure Word + Noun ::,Expressing quantity,"Using ""ji"" to mean ""several""",https://resources.allsetlearning.com/chinese/grammar/ASGHC9CA
妈妈 每 个 月 都 给 我 几 百 块 钱 。,妈妈每个月都给我几百块钱。,māmā měi gè yuè dū gěi wǒ jī bǎi kuài qián 。,My mother gives me hundreds of dollars every month.,[sound:hsk2_grammar_sent287.mp3],:: 几 + 百 / 千 / 万 + Measure Word + Noun ::,Expressing quantity,"Using ""ji"" to mean ""several""",https://resources.allsetlearning.com/chinese/grammar/ASGHC9CA
这 个 月 我们 卖 了 几 千 本 书 。,这个月我们卖了几千本书。,zhè gè yuè wǒmen mài le jī qiān běn shū 。,We sold thousands of books this month.,[sound:hsk2_grammar_sent288.mp3],:: 几 + 百 / 千 / 万 + Measure Word + Noun ::,Expressing quantity,"Using ""ji"" to mean ""several""",https://resources.allsetlearning.com/chinese/grammar/ASGHC9CA
