他 宁可 和 女朋友 分手 ，也要 留 在 国外 。,他宁可和女朋友分手，也要留在国外。,tā níngkě hé nv̌péngyǒu fēnshǒu ，yěyào líu zài guówài 。,He would rather break up with his girlfriend and stay abroad.,[sound:hsk5_grammar_sent800.mp3],:: 宁可 ⋯⋯ ，也要 / 也不 ⋯⋯ ::,Giving alternatives,"Expressing ""would rather"" with ""ningke""",https://resources.allsetlearning.com/chinese/grammar/ASGF3F2Y
她 宁可 花 一半 的 工资 租 房子 ，也要 一个人 住 。,她宁可花一半的工资租房子，也要一个人住。,tā níngkě huā yībàn de gōngzī zū fángzǐ ，yěyào yīgèrén zhù 。,She would rather rent a house for half of her salary and live alone.,[sound:hsk5_grammar_sent801.mp3],:: 宁可 ⋯⋯ ，也要 / 也不 ⋯⋯ ::,Giving alternatives,"Expressing ""would rather"" with ""ningke""",https://resources.allsetlearning.com/chinese/grammar/ASGF3F2Y
学 中文 少不了 要 学 拼音 和 汉字 。,学中文少不了要学拼音和汉字。,xué zhōngwén shǎobùle yào xué pīnyīn hé hànzì 。,"To learn Chinese, you must learn Pinyin and Chinese characters.",[sound:hsk5_grammar_sent802.mp3],:: Subj. + 少不了 + 要 + [Verb Phrase] ::,"Referring to simultaneous events, Indicating conditions, Indicating cause and effect","Occurring together with ""shaobuliao""",https://resources.allsetlearning.com/chinese/grammar/ASG3IR71
回家 过年 少不了 要 带 点 礼物 给 家人 。,回家过年少不了要带点礼物给家人。,húijiā guònián shǎobùle yào dài diǎn lǐwù gěi jiārén 。,You must bring some gifts to your family when you go home for Chinese New Year.,[sound:hsk5_grammar_sent803.mp3],:: Subj. + 少不了 + 要 + [Verb Phrase] ::,"Referring to simultaneous events, Indicating conditions, Indicating cause and effect","Occurring together with ""shaobuliao""",https://resources.allsetlearning.com/chinese/grammar/ASG3IR71
过 生日 少不了 要 吃 生日 蛋糕 。,过生日少不了要吃生日蛋糕。,guò shēngrì shǎobùle yào chī shēngrì dàngāo 。,You must have a birthday cake for your birthday.,[sound:hsk5_grammar_sent804.mp3],:: Subj. + 少不了 + 要 + [Verb Phrase] ::,"Referring to simultaneous events, Indicating conditions, Indicating cause and effect","Occurring together with ""shaobuliao""",https://resources.allsetlearning.com/chinese/grammar/ASG3IR71
大家 都 是 邻居 ，以后 少不了 要 麻烦 您 。,大家都是邻居，以后少不了要麻烦您。,dàjiā dū shì línjū ，yǐhòu shǎobùle yào máfán nín 。,"Everyone is a neighbor, so I have to trouble you in the future.",[sound:hsk5_grammar_sent805.mp3],:: Subj. + 少不了 + 要 + [Verb Phrase] ::,"Referring to simultaneous events, Indicating conditions, Indicating cause and effect","Occurring together with ""shaobuliao""",https://resources.allsetlearning.com/chinese/grammar/ASG3IR71
八点 多 了 还 没 回 来，少不了 是 在 加班 。,八点多了还没回来，少不了是在加班。,bādiǎn duō le huán méi húi lái，shǎobùle shì zài jiābān 。,It's more than eight o'clock and I haven't returned.,[sound:hsk5_grammar_sent806.mp3],:: Situation / Result ，少不了 + 是 + Reason ::,"Referring to simultaneous events, Indicating conditions, Indicating cause and effect","Occurring together with ""shaobuliao""",https://resources.allsetlearning.com/chinese/grammar/ASG3IR71
看 他 的 样子，少不了 是 跟 女 朋友 吵架 了 。,看他的样子，少不了是跟女朋友吵架了。,kàn tā de yángzǐ，shǎobùle shì gēn nv̌ péngyǒu chǎojià le 。,"Looking at him, it is inevitable that he quarreled with his girlfriend.",[sound:hsk5_grammar_sent807.mp3],:: Situation / Result ，少不了 + 是 + Reason ::,"Referring to simultaneous events, Indicating conditions, Indicating cause and effect","Occurring together with ""shaobuliao""",https://resources.allsetlearning.com/chinese/grammar/ASG3IR71
这么 闷热，少不了 是 要 下 暴雨 。,这么闷热，少不了是要下暴雨。,zhèyāo mènrè，shǎobùle shì yào xià bàoyǔ 。,"It's so sultry, it is inevitable that it is going to rain.",[sound:hsk5_grammar_sent808.mp3],:: Situation / Result ，少不了 + 是 + Reason ::,"Referring to simultaneous events, Indicating conditions, Indicating cause and effect","Occurring together with ""shaobuliao""",https://resources.allsetlearning.com/chinese/grammar/ASG3IR71
今天吃了炸鸡，等于白跑步了.,今天吃了炸鸡，等于白跑步了.,jīntiānchīlezhàjī，děngyúbáipǎobùle.,Eating fried chicken today is equivalent to white running.,[sound:hsk5_grammar_sent809.mp3],":: A, 等于 B ::",Expressing to come from,"Using ""dengyu"" to express ""equal to""",https://resources.allsetlearning.com/chinese/grammar/ASGB449A
你告诉小王就等于把秘密告诉了大家.,你告诉小王就等于把秘密告诉了大家.,nǐgàosùxiǎowángjìuděngyúbǎmìmìgàosùledàjiā.,You tell Xiao Wang that you are telling everyone the secret.,[sound:hsk5_grammar_sent810.mp3],":: A, 等于 B ::",Expressing to come from,"Using ""dengyu"" to express ""equal to""",https://resources.allsetlearning.com/chinese/grammar/ASGB449A
浪费时间等于浪费生命.,浪费时间等于浪费生命.,làngfèishíjiānděngyúlàngfèishēngmìng.,A waste of time is a waste of life.,[sound:hsk5_grammar_sent811.mp3],":: A, 等于 B ::",Expressing to come from,"Using ""dengyu"" to express ""equal to""",https://resources.allsetlearning.com/chinese/grammar/ASGB449A
小张 请假 了，怪不得 今天 没有 看到 他 。,小张请假了，怪不得今天没有看到他。,xiǎozhāng qǐngjiǎ le，guàibùdé jīntiān méiyǒu kàndào tā 。,"Xiao Zhang asked for leave, no wonder he didn't see him today.",[sound:hsk5_grammar_sent812.mp3],:: Reason ，怪不得 / 难怪 + [Observation] ::,Exclaiming,"Expressing ""no wonder""",https://resources.allsetlearning.com/chinese/grammar/ASGFPV2C
天天 迟到 ，怪不得 他 被 炒鱿鱼 了 。,天天迟到，怪不得他被炒鱿鱼了。,tiāntiān chídào ，guàibùdé tā bèi chǎoyóuyú le 。,"Late every day, no wonder he was fired.",[sound:hsk5_grammar_sent813.mp3],:: Reason ，怪不得 / 难怪 + [Observation] ::,Exclaiming,"Expressing ""no wonder""",https://resources.allsetlearning.com/chinese/grammar/ASGFPV2C
她 是 你 妹妹 ？难怪 你们 长 得 这么 像 。,她是你妹妹？难怪你们长得这么像。,tā shì nǐ mèimèi ？nánguài nǐmen cháng dé zhèyāo xiàng 。,Is she your sister? No wonder you look so similar.,[sound:hsk5_grammar_sent814.mp3],:: Reason ，怪不得 / 难怪 + [Observation] ::,Exclaiming,"Expressing ""no wonder""",https://resources.allsetlearning.com/chinese/grammar/ASGFPV2C
你 手机 没电 了 ？怪不得 我 打 不 通 。,你手机没电了？怪不得我打不通。,nǐ shǒujī méidiàn le ？guàibùdé wǒ dǎ bù tōng 。,Is your phone dead? No wonder I can't get through.,[sound:hsk5_grammar_sent815.mp3],:: Reason ，怪不得 / 难怪 + [Observation] ::,Exclaiming,"Expressing ""no wonder""",https://resources.allsetlearning.com/chinese/grammar/ASGFPV2C
你 放 了 醋 ？难怪 这么 难吃 ！,你放了醋？难怪这么难吃！,nǐ fàng le cù ？nánguài zhèyāo nánchī ！,You put vinegar? No wonder it's so bad!,[sound:hsk5_grammar_sent816.mp3],:: Reason ，怪不得 / 难怪 + [Observation] ::,Exclaiming,"Expressing ""no wonder""",https://resources.allsetlearning.com/chinese/grammar/ASGFPV2C
难怪 学生 都 不 喜欢 这个 老师 ，原来 他 的 作业 太 多 了 。,难怪学生都不喜欢这个老师，原来他的作业太多了。,nánguài xuéshēng dū bù xǐhuān zhègè lǎoshī ，yuánlái tā de zuòyè tài duō le 。,"No wonder students do not like this teacher, because he has too many homework.",[sound:hsk5_grammar_sent817.mp3],:: 怪不得 / 难怪 + [Observation] ，原来 (+ 是) + Reason ::,Exclaiming,"Expressing ""no wonder""",https://resources.allsetlearning.com/chinese/grammar/ASGFPV2C
怪不得 你们 这么 高兴 ，原来 是 要 结婚 了 。,怪不得你们这么高兴，原来是要结婚了。,guàibùdé nǐmen zhèyāo gāoxīng ，yuánlái shì yào jiéhūn le 。,No wonder you are so happy that you are getting married.,[sound:hsk5_grammar_sent818.mp3],:: 怪不得 / 难怪 + [Observation] ，原来 (+ 是) + Reason ::,Exclaiming,"Expressing ""no wonder""",https://resources.allsetlearning.com/chinese/grammar/ASGFPV2C
难怪 这里 人 这么 多 ，原来 在 打折 。,难怪这里人这么多，原来在打折。,nánguài zhèlǐ rén zhèyāo duō ，yuánlái zài dǎzhé 。,"No wonder there are so many people here, it turned out to be discounted.",[sound:hsk5_grammar_sent819.mp3],:: 怪不得 / 难怪 + [Observation] ，原来 (+ 是) + Reason ::,Exclaiming,"Expressing ""no wonder""",https://resources.allsetlearning.com/chinese/grammar/ASGFPV2C
怪不得 她 拉肚子 ，原来 她 昨天 又 吃 火锅 了 。,怪不得她拉肚子，原来她昨天又吃火锅了。,guàibùdé tā lādùzǐ ，yuánlái tā zuótiān yòu chī huǒguō le 。,No wonder she had diarrhea. It turned out that she ate hot pot yesterday.,[sound:hsk5_grammar_sent820.mp3],:: 怪不得 / 难怪 + [Observation] ，原来 (+ 是) + Reason ::,Exclaiming,"Expressing ""no wonder""",https://resources.allsetlearning.com/chinese/grammar/ASGFPV2C
怪不得 他 没 告诉 我 ，原来 是 不 想 让 我 担心 。,怪不得他没告诉我，原来是不想让我担心。,guàibùdé tā méi gàosù wǒ ，yuánlái shì bù xiǎng ràng wǒ dànxīn 。,No wonder he didn't tell me that he didn't want to worry me.,[sound:hsk5_grammar_sent821.mp3],:: 怪不得 / 难怪 + [Observation] ，原来 (+ 是) + Reason ::,Exclaiming,"Expressing ""no wonder""",https://resources.allsetlearning.com/chinese/grammar/ASGFPV2C
这 也 难怪 他 ，他 这么 小 。,这也难怪他，他这么小。,zhè yě nánguài tā ，tā zhèyāo xiǎo 。,No wonder he is so small.,[sound:hsk5_grammar_sent822.mp3],:: 怪不得 / 难怪 + [Observation] ，原来 (+ 是) + Reason ::,Exclaiming,"Expressing ""no wonder""",https://resources.allsetlearning.com/chinese/grammar/ASGFPV2C
这 也 难怪 大家 ，是 我们 通知 晚 了 。,这也难怪大家，是我们通知晚了。,zhè yě nánguài dàjiā ，shì wǒmen tōngzhī wǎn le 。,"It ’s no wonder everyone, it ’s because we ’re late.",[sound:hsk5_grammar_sent823.mp3],:: 怪不得 / 难怪 + [Observation] ，原来 (+ 是) + Reason ::,Exclaiming,"Expressing ""no wonder""",https://resources.allsetlearning.com/chinese/grammar/ASGFPV2C
只 有 一 块 蛋糕，或者 你 吃 或者 我 吃 。,只有一块蛋糕，或者你吃或者我吃。,zhǐ yǒu yī kuài dàngāo，huòzhě nǐ chī huòzhě wǒ chī 。,"There is only one piece of cake, either you eat or I eat.",[sound:hsk5_grammar_sent824.mp3],:: 或者 A ，或者 B ::,Giving alternatives,"Providing two options with double ""huozhe""",https://resources.allsetlearning.com/chinese/grammar/ASGYXI5X
你 或者 学 汉语 ， 或者 学 法律，别的就别学了 。,你或者学汉语，或者学法律，别的就别学了。,nǐ huòzhě xué hànyǔ ， huòzhě xué fǎlv̀，biédejìubiéxuéle 。,"You can learn Chinese or law, and do n’t learn anything else.",[sound:hsk5_grammar_sent825.mp3],:: 或者 A ，或者 B ::,Giving alternatives,"Providing two options with double ""huozhe""",https://resources.allsetlearning.com/chinese/grammar/ASGYXI5X
咱们 或者 去 爬山 或者 泡温泉 。,咱们或者去爬山或者泡温泉。,zánmen huòzhě qù páshān huòzhě pàowēnquán 。,Let's go mountain climbing or hot spring bathing.,[sound:hsk5_grammar_sent826.mp3],:: 或者 A ，或者 B ::,Giving alternatives,"Providing two options with double ""huozhe""",https://resources.allsetlearning.com/chinese/grammar/ASGYXI5X
别说 一百， 就是 一 块 钱 我 也 不 给 你 。,别说一百，就是一块钱我也不给你。,biéshuō yībǎi， jìushì yī kuài qián wǒ yě bù gěi nǐ 。,"Not to mention one hundred, I won't give you a dollar.",[sound:hsk5_grammar_sent827.mp3],:: 别说 + A ， 连 / 就是+ B + 也 / 都 + Verb ::,Expressing determination,"Expressing ""let alone"" with ""bie shuo""",https://resources.allsetlearning.com/chinese/grammar/ASGR6Q2J
别说 白酒，连 啤酒 的 味道 我 都 受 不了 。,别说白酒，连啤酒的味道我都受不了。,biéshuō báijǐu，lián píjǐu de wèidào wǒ dū shòu bùle 。,"Not to mention liquor, I can't even bear the taste of beer.",[sound:hsk5_grammar_sent828.mp3],:: 别说 + A ， 连 / 就是+ B + 也 / 都 + Verb ::,Expressing determination,"Expressing ""let alone"" with ""bie shuo""",https://resources.allsetlearning.com/chinese/grammar/ASGR6Q2J
这么 难 的 问题，别说 你，就是 老师 也 不 知道 答案 。,这么难的问题，别说你，就是老师也不知道答案。,zhèyāo nán de wèntí，biéshuō nǐ，jìushì lǎoshī yě bù zhīdào dáàn 。,"Such a difficult question, let alone you, even the teacher does not know the answer.",[sound:hsk5_grammar_sent829.mp3],:: 别说 + A ， 连 / 就是+ B + 也 / 都 + Verb ::,Expressing determination,"Expressing ""let alone"" with ""bie shuo""",https://resources.allsetlearning.com/chinese/grammar/ASGR6Q2J
别说 做 菜 了，他 连 怎么 煮 方便面 都 不 知道 。,别说做菜了，他连怎么煮方便面都不知道。,biéshuō zuò cài le，tā lián zěnyāo zhǔ fāngbiànmiàn dū bù zhīdào 。,"Not to mention cooking, he didn't even know how to cook instant noodles.",[sound:hsk5_grammar_sent830.mp3],:: 别说 + A ， 连 / 就是+ B + 也 / 都 + Verb ::,Expressing determination,"Expressing ""let alone"" with ""bie shuo""",https://resources.allsetlearning.com/chinese/grammar/ASGR6Q2J
他 都 不 会 煮 鸡蛋， 更不用说 做 一 大 桌子 的 菜 了 。,他都不会煮鸡蛋，更不用说做一大桌子的菜了。,tā dū bù hùi zhǔ jīdàn， gèngbùyòngshuō zuò yī dà zhuōzǐ de cài le 。,"He doesn't know how to cook eggs, let alone cook a large table.",[sound:hsk5_grammar_sent831.mp3],:: 连 + A + 都 / 也 + Verb， 更不用说 + B + 了 ::,Expressing determination,"Expressing ""let alone"" with ""geng buyong shuo""",https://resources.allsetlearning.com/chinese/grammar/ASGHOI8S
他 连 自己 国家 的 国旗 都 不 认识， 更不用说 其他 国家 的 了 。,他连自己国家的国旗都不认识，更不用说其他国家的了。,tā lián zìjǐ guójiā de guóqí dū bù rènshì， gèngbùyòngshuō qítā guójiā de le 。,"He doesn't even know the national flag of his own country, let alone other countries.",[sound:hsk5_grammar_sent832.mp3],:: 连 + A + 都 / 也 + Verb， 更不用说 + B + 了 ::,Expressing determination,"Expressing ""let alone"" with ""geng buyong shuo""",https://resources.allsetlearning.com/chinese/grammar/ASGHOI8S
他 从来 没有 出 过 远门， 更不用说 出国 了 。,他从来没有出过远门，更不用说出国了。,tā cónglái méiyǒu chū guò yuǎnmén， gèngbùyòngshuō chūguó le 。,"He has never been far away, let alone abroad.",[sound:hsk5_grammar_sent833.mp3],:: 连 + A + 都 / 也 + Verb， 更不用说 + B + 了 ::,Expressing determination,"Expressing ""let alone"" with ""geng buyong shuo""",https://resources.allsetlearning.com/chinese/grammar/ASGHOI8S
这 句 话 连 孩子 都 懂 ，何况 大人 呢 ？,这句话连孩子都懂，何况大人呢？,zhè jù huà lián háizǐ dū dǒng ，hékuàng dàrén ní ？,"Even children can understand this sentence, not to mention adults?",[sound:hsk5_grammar_sent834.mp3],:: Subj. + 连 ⋯⋯ 都 + Verb ，何况 ⋯⋯ 呢 ？ ::,"Expressing attitude, Expressing determination","Expressing ""let alone"" with ""hekuang""",https://resources.allsetlearning.com/chinese/grammar/ASG3ZS9G
他 连 那么 难 的 题 都 会，何况 一个 这么 简单 的 题 呢 ？,他连那么难的题都会，何况一个这么简单的题呢？,tā lián nàyāo nán de tí dū hùi，hékuàng yīgè zhèyāo jiǎndān de tí ní ？,"He even has such difficult questions, not to mention such a simple question?",[sound:hsk5_grammar_sent835.mp3],:: Subj. + 连 ⋯⋯ 都 + Verb ，何况 ⋯⋯ 呢 ？ ::,"Expressing attitude, Expressing determination","Expressing ""let alone"" with ""hekuang""",https://resources.allsetlearning.com/chinese/grammar/ASG3ZS9G
我 奶奶 连 高铁 都 没 坐 过 ，何况 飞机 呢 ？,我奶奶连高铁都没坐过，何况飞机呢？,wǒ nǎinǎi lián gāotiě dū méi zuò guò ，hékuàng fēijī ní ？,"My grandmother hasn't even sat on a high-speed train, let alone a plane?",[sound:hsk5_grammar_sent836.mp3],:: Subj. + 连 ⋯⋯ 都 + 不 / 没 + Verb ，何况 ⋯⋯ 呢 ？ ::,"Expressing attitude, Expressing determination","Expressing ""let alone"" with ""hekuang""",https://resources.allsetlearning.com/chinese/grammar/ASG3ZS9G
宝宝 连 走 都 不 会，更 何况 跑 呢 ？,宝宝连走都不会，更何况跑呢？,bǎobǎo lián zǒu dū bù hùi，gèng hékuàng pǎo ní ？,"The baby can't even walk, let alone run?",[sound:hsk5_grammar_sent837.mp3],:: Subj. + 连 ⋯⋯ 都 + 不 / 没 + Verb ，何况 ⋯⋯ 呢 ？ ::,"Expressing attitude, Expressing determination","Expressing ""let alone"" with ""hekuang""",https://resources.allsetlearning.com/chinese/grammar/ASG3ZS9G
我 连 他 叫 什么 都 不 知道 ，又 何况 他 的 电话 号码 呢 ？,我连他叫什么都不知道，又何况他的电话号码呢？,wǒ lián tā jiào shíyāo dū bù zhīdào ，yòu hékuàng tā de diànhuà hàomǎ ní ？,"I do n’t even know what his name is, let alone his phone number?",[sound:hsk5_grammar_sent838.mp3],:: Subj. + 连 ⋯⋯ 都 + 不 / 没 + Verb ，何况 ⋯⋯ 呢 ？ ::,"Expressing attitude, Expressing determination","Expressing ""let alone"" with ""hekuang""",https://resources.allsetlearning.com/chinese/grammar/ASG3ZS9G
他 在家 就 不 爱 说话 ，何况 是 在 外面 ？,他在家就不爱说话，何况是在外面？,tā zàijiā jìu bù ài shuōhuà ，hékuàng shì zài wàimiàn ？,"He doesn't talk at home, let alone outside?",[sound:hsk5_grammar_sent839.mp3],:: Subj. (+ 尚且) + 都 / 就 ⋯⋯ ，（更）何况 ⋯⋯ ::,"Expressing attitude, Expressing determination","Expressing ""let alone"" with ""hekuang""",https://resources.allsetlearning.com/chinese/grammar/ASG3ZS9G
这个 东西 两 个 男人 都 搬 不 动 ，何况 一 个 女人 ？,这个东西两个男人都搬不动，何况一个女人？,zhègè dōngxī liǎng gè nánrén dū bān bù dòng ，hékuàng yī gè nv̌rén ？,"Neither man can move this thing, let alone a woman?",[sound:hsk5_grammar_sent840.mp3],:: Subj. (+ 尚且) + 都 / 就 ⋯⋯ ，（更）何况 ⋯⋯ ::,"Expressing attitude, Expressing determination","Expressing ""let alone"" with ""hekuang""",https://resources.allsetlearning.com/chinese/grammar/ASG3ZS9G
这个 地方 本来 就 不 好 找 ，更何况 你 是 第一 次 来 ？,这个地方本来就不好找，更何况你是第一次来？,zhègè dìfāng běnlái jìu bù hǎo zhǎo ，gènghékuàng nǐ shì dìyī cì lái ？,"This place is not easy to find, not to mention your first visit?",[sound:hsk5_grammar_sent841.mp3],:: Subj. (+ 尚且) + 都 / 就 ⋯⋯ ，（更）何况 ⋯⋯ ::,"Expressing attitude, Expressing determination","Expressing ""let alone"" with ""hekuang""",https://resources.allsetlearning.com/chinese/grammar/ASG3ZS9G
大人 尚且 做 不 到 ，更何况 孩子 ？,大人尚且做不到，更何况孩子？,dàrén shàngqiě zuò bù dào ，gènghékuàng háizǐ ？,"Adults can't do it, let alone children?",[sound:hsk5_grammar_sent842.mp3],:: Subj. (+ 尚且) + 都 / 就 ⋯⋯ ，（更）何况 ⋯⋯ ::,"Expressing attitude, Expressing determination","Expressing ""let alone"" with ""hekuang""",https://resources.allsetlearning.com/chinese/grammar/ASG3ZS9G
中国 人 尚且 不 了解 ，更何况 外国 人 ？,中国人尚且不了解，更何况外国人？,zhōngguó rén shàngqiě bù lejiě ，gènghékuàng wàiguó rén ？,"The Chinese do not yet understand, let alone foreigners?",[sound:hsk5_grammar_sent843.mp3],:: Subj. (+ 尚且) + 都 / 就 ⋯⋯ ，（更）何况 ⋯⋯ ::,"Expressing attitude, Expressing determination","Expressing ""let alone"" with ""hekuang""",https://resources.allsetlearning.com/chinese/grammar/ASG3ZS9G
他 不仅 很 帅，而且 很 聪明 。,他不仅很帅，而且很聪明。,tā bùjǐn hěn shuài，érqiě hěn cōngmíng 。,"He is not only handsome, but also very smart.",[sound:hsk5_grammar_sent844.mp3],:: Noun + 不仅 + A，而且 + B ::,"Adding more explanation, Giving alternatives","Expressing ""not only… but also"" with ""bujin""",https://resources.allsetlearning.com/chinese/grammar/ASGEM2VR
我们 不仅 完成 了 任务 而且 比 规定 日期 提前 了 十天 。,我们不仅完成了任务而且比规定日期提前了十天。,wǒmen bùjǐn wánchéng le rènwù érqiě bǐ gūidìng rìqī tíqián le shítiān 。,Not only did we complete the task but we were ten days ahead of the set date.,[sound:hsk5_grammar_sent845.mp3],:: Noun + 不仅 + A，而且 + B ::,"Adding more explanation, Giving alternatives","Expressing ""not only… but also"" with ""bujin""",https://resources.allsetlearning.com/chinese/grammar/ASGEM2VR
这 道 菜不仅 好吃 而且 很 有 营养 。,这道菜不仅好吃而且很有营养。,zhè dào càibùjǐn hǎochī érqiě hěn yǒu yíngyǎng 。,This dish is not only delicious but also very nutritious.,[sound:hsk5_grammar_sent846.mp3],:: Noun + 不仅 + A，而且 + B ::,"Adding more explanation, Giving alternatives","Expressing ""not only… but also"" with ""bujin""",https://resources.allsetlearning.com/chinese/grammar/ASGEM2VR
客户 不断地 改变 主意，怎么 办 ？,客户不断地改变主意，怎么办？,kèhù bùduàndì gǎibiàn zhǔyì，zěnyāo bàn ？,What should customers do if they constantly change their minds?,[sound:hsk5_grammar_sent847.mp3],:: Subj. + 不断 + 地 + Verb ::,"Expressing duration, Expressing time and date, Expressing attitude","Comparing ""buduan"" and ""buting""",https://resources.allsetlearning.com/chinese/grammar/ASGIKHUH
过去 的 两 年 里，我们 不断地 在 努力，也 不断地 在 进步 。,过去的两年里，我们不断地在努力，也不断地在进步。,guòqù de liǎng nián lǐ，wǒmen bùduàndì zài nǔlì，yě bùduàndì zài jìnbù 。,"In the past two years, we have been working hard and making progress.",[sound:hsk5_grammar_sent848.mp3],:: Subj. + 不断 + 地 + Verb ::,"Expressing duration, Expressing time and date, Expressing attitude","Comparing ""buduan"" and ""buting""",https://resources.allsetlearning.com/chinese/grammar/ASGIKHUH
他们 之间 的 矛盾 一直 不断，关系 不断 恶化 。,他们之间的矛盾一直不断，关系不断恶化。,tāmen zhījiān de máodùn yīzhí bùduàn，guānxì bùduàn èhuà 。,"The contradiction between them has been constant, and the relationship has continued to deteriorate.",[sound:hsk5_grammar_sent849.mp3],:: Subj. + 不断 + 地 + Verb ::,"Expressing duration, Expressing time and date, Expressing attitude","Comparing ""buduan"" and ""buting""",https://resources.allsetlearning.com/chinese/grammar/ASGIKHUH
我今天很困，不停地打哈欠 。,我今天很困，不停地打哈欠。,wǒjīntiānhěnkùn，bùtíngdìdǎhāqiàn 。,I am very sleepy today and I keep yawning.,[sound:hsk5_grammar_sent850.mp3],:: Subj. + 不停 + 地 + Verb ::,"Expressing duration, Expressing time and date, Expressing attitude","Comparing ""buduan"" and ""buting""",https://resources.allsetlearning.com/chinese/grammar/ASGIKHUH
感冒了，喉咙痛，还不停地留鼻水 。,感冒了，喉咙痛，还不停地留鼻水。,gǎnmàole，hóulóngtòng，huánbùtíngdìlíubíshǔi 。,"He had a cold, a sore throat, and kept running his nose.",[sound:hsk5_grammar_sent851.mp3],:: Subj. + 不停 + 地 + Verb ::,"Expressing duration, Expressing time and date, Expressing attitude","Comparing ""buduan"" and ""buting""",https://resources.allsetlearning.com/chinese/grammar/ASGIKHUH
吃饭的时候他一句话也不说，不停地吃 。,吃饭的时候他一句话也不说，不停地吃。,chīfàndeshíhòutāyījùhuàyěbùshuō，bùtíngdìchī 。,He didn't say a word while eating and kept eating.,[sound:hsk5_grammar_sent852.mp3],:: Subj. + 不停 + 地 + Verb ::,"Expressing duration, Expressing time and date, Expressing attitude","Comparing ""buduan"" and ""buting""",https://resources.allsetlearning.com/chinese/grammar/ASGIKHUH
孩子 哭 个不停，是 不 是 发烧 了 ？,孩子哭个不停，是不是发烧了？,háizǐ kū gèbùtíng，shì bù shì fāshāo le ？,Is the child crying all the time?,[sound:hsk5_grammar_sent853.mp3],:: Subj. + Verb + 个 + 不停 ::,"Expressing duration, Expressing time and date, Expressing attitude","Comparing ""buduan"" and ""buting""",https://resources.allsetlearning.com/chinese/grammar/ASGIKHUH
今天 电话 响个不停，烦 死 了 。,今天电话响个不停，烦死了。,jīntiān diànhuà xiǎnggèbùtíng，fán sǐ le 。,The phone was ringing today and it was annoying.,[sound:hsk5_grammar_sent854.mp3],:: Subj. + Verb + 个 + 不停 ::,"Expressing duration, Expressing time and date, Expressing attitude","Comparing ""buduan"" and ""buting""",https://resources.allsetlearning.com/chinese/grammar/ASGIKHUH
