在 家 看 电视 多 无聊 ！不如 去 KTV 吧 。,在家看电视多无聊！不如去KTV吧。,zài jiā kàn diànshì duō wúliáo ！bùrú qù KTV ba 。,How boring to watch TV at home! Why not go to KTV.,[sound:hsk5_grammar_sent493.mp3],:: A + 不如 + B + Adj. :: / :: A + Verb + 得 + 不如 + B + Adj. :: / :: A + Verb-Obj. + 不如 + B+ (Verb + 得) + Adj. ::,"Denying and refusing, Comparing","Comparisons with ""buru""",https://resources.allsetlearning.com/chinese/grammar/ASGWH1D5
我们 在 这里 等 也 是 浪费 时间 ，不如 先 去 吃 个 饭 吧 。,我们在这里等也是浪费时间，不如先去吃个饭吧。,wǒmen zài zhèlǐ děng yě shì làngfèi shíjiān ，bùrú xiān qù chī gè fàn ba 。,"It is also a waste of time for us to wait here, it is better to have a meal first.",[sound:hsk5_grammar_sent494.mp3],:: A + 不如 + B + Adj. :: / :: A + Verb + 得 + 不如 + B + Adj. :: / :: A + Verb-Obj. + 不如 + B+ (Verb + 得) + Adj. ::,"Denying and refusing, Comparing","Comparisons with ""buru""",https://resources.allsetlearning.com/chinese/grammar/ASGWH1D5
与其 空想，不如 马上 行动 。,与其空想，不如马上行动。,yǔqí kōngxiǎng，bùrú mǎshàng xíngdòng 。,"Rather than dreaming, act now.",[sound:hsk5_grammar_sent495.mp3],:: A + 不如 + B + Adj. :: / :: A + Verb + 得 + 不如 + B + Adj. :: / :: A + Verb-Obj. + 不如 + B+ (Verb + 得) + Adj. ::,"Denying and refusing, Comparing","Comparisons with ""buru""",https://resources.allsetlearning.com/chinese/grammar/ASGWH1D5
与其 天天 吵架 ，不如 离婚 。,与其天天吵架，不如离婚。,yǔqí tiāntiān chǎojià ，bùrú líhūn 。,It is better to divorce than to quarrel every day.,[sound:hsk5_grammar_sent496.mp3],:: A + 不如 + B + Adj. :: / :: A + Verb + 得 + 不如 + B + Adj. :: / :: A + Verb-Obj. + 不如 + B+ (Verb + 得) + Adj. ::,"Denying and refusing, Comparing","Comparisons with ""buru""",https://resources.allsetlearning.com/chinese/grammar/ASGWH1D5
现代化,现代化,xiàndàihuà,modernization,[sound:hsk5_grammar_sent497.mp3],:: Noun / Adj. + 化 ::,Describing actions,"Making ""-ize"" and ""-ify"" verbs with ""hua""",https://resources.allsetlearning.com/chinese/grammar/ASGS6UKN
中国化,中国化,zhōngguóhuà,Chinese Characteristics,[sound:hsk5_grammar_sent498.mp3],:: Noun / Adj. + 化 ::,Describing actions,"Making ""-ize"" and ""-ify"" verbs with ""hua""",https://resources.allsetlearning.com/chinese/grammar/ASGS6UKN
美国化,美国化,měiguóhuà,Americanization,[sound:hsk5_grammar_sent499.mp3],:: Noun / Adj. + 化 ::,Describing actions,"Making ""-ize"" and ""-ify"" verbs with ""hua""",https://resources.allsetlearning.com/chinese/grammar/ASGS6UKN
KFC 的 中国 本土化 经营 做 得 非常 成功 。,KFC的中国本土化经营做得非常成功。,KFC de zhōngguó běntǔhuà jīngyíng zuò dé fēicháng chénggōng 。,KFC's localized operation in China has been very successful.,[sound:hsk5_grammar_sent500.mp3],:: Noun / Adj. + 化 ::,Describing actions,"Making ""-ize"" and ""-ify"" verbs with ""hua""",https://resources.allsetlearning.com/chinese/grammar/ASGS6UKN
邓小平 提出了 四 个 现代化：工业现代化、农业现代化、国防现代化、科学技术现代化 。,邓小平提出了四个现代化：工业现代化、农业现代化、国防现代化、科学技术现代化。,dèngxiǎopíng tíchūle sì gè xiàndàihuà：gōngyèxiàndàihuà、nóngyèxiàndàihuà、guófángxiàndàihuà、kēxuéjìzhúxiàndàihuà 。,"Deng Xiaoping proposed four modernizations: industrial modernization, agricultural modernization, national defense modernization, and science and technology modernization.",[sound:hsk5_grammar_sent501.mp3],:: Noun / Adj. + 化 ::,Describing actions,"Making ""-ize"" and ""-ify"" verbs with ""hua""",https://resources.allsetlearning.com/chinese/grammar/ASGS6UKN
现在 我们 公司 的工作 流程 和 人事 管理 已经 初步 制度化 了 。,现在我们公司的工作流程和人事管理已经初步制度化了。,xiànzài wǒmen gōngsī degōngzuò líuchéng hé rénshì guǎnlǐ yǐjīng chūbù zhìdùhuà le 。,Now our company's work flow and personnel management have been preliminarily institutionalized.,[sound:hsk5_grammar_sent502.mp3],:: Noun / Adj. + 化 ::,Describing actions,"Making ""-ize"" and ""-ify"" verbs with ""hua""",https://resources.allsetlearning.com/chinese/grammar/ASGS6UKN
美化,美化,měihuà,beautify,[sound:hsk5_grammar_sent503.mp3],:: Noun / Adj. + 化 ::,Describing actions,"Making ""-ize"" and ""-ify"" verbs with ""hua""",https://resources.allsetlearning.com/chinese/grammar/ASGS6UKN
绿化,绿化,lv̀huà,Greening,[sound:hsk5_grammar_sent504.mp3],:: Noun / Adj. + 化 ::,Describing actions,"Making ""-ize"" and ""-ify"" verbs with ""hua""",https://resources.allsetlearning.com/chinese/grammar/ASGS6UKN
软化,软化,ruǎnhuà,soften,[sound:hsk5_grammar_sent505.mp3],:: Noun / Adj. + 化 ::,Describing actions,"Making ""-ize"" and ""-ify"" verbs with ""hua""",https://resources.allsetlearning.com/chinese/grammar/ASGS6UKN
你 应该 让 黄油 软化，然后 跟 面包 一起 吃 。,你应该让黄油软化，然后跟面包一起吃。,nǐ yìnggāi ràng huángyóu ruǎnhuà，ránhòu gēn miànbāo yīqǐ chī 。,You should soften the butter and eat it with bread.,[sound:hsk5_grammar_sent506.mp3],:: Noun / Adj. + 化 ::,Describing actions,"Making ""-ize"" and ""-ify"" verbs with ""hua""",https://resources.allsetlearning.com/chinese/grammar/ASGS6UKN
我们 保护 环境 是 为了 美化 我们 的 城市 。,我们保护环境是为了美化我们的城市。,wǒmen bǎohù huánjìng shì wèile měihuà wǒmen de chéngshì 。,We protect the environment to beautify our city.,[sound:hsk5_grammar_sent507.mp3],:: Noun / Adj. + 化 ::,Describing actions,"Making ""-ize"" and ""-ify"" verbs with ""hua""",https://resources.allsetlearning.com/chinese/grammar/ASGS6UKN
每年 我们 的 绿化 面积 都 在 扩大 。,每年我们的绿化面积都在扩大。,měinián wǒmen de lv̀huà miànjī dū zài kuòdà 。,Every year our green area is expanding.,[sound:hsk5_grammar_sent508.mp3],:: Noun / Adj. + 化 ::,Describing actions,"Making ""-ize"" and ""-ify"" verbs with ""hua""",https://resources.allsetlearning.com/chinese/grammar/ASGS6UKN
她 算 天才 。,她算天才。,tā suàn tiāncái 。,She is a genius.,[sound:hsk5_grammar_sent509.mp3],:: Subj. (+ 不) + 算 + Noun ::,"Adding more explanation, Expressing quality","Making judgments with ""suan""",https://resources.allsetlearning.com/chinese/grammar/ASGWDWFN
这 算 秘密 吗 ？,这算秘密吗？,zhè suàn mìmì ma ？,Is this a secret?,[sound:hsk5_grammar_sent510.mp3],:: Subj. (+ 不) + 算 + Noun ::,"Adding more explanation, Expressing quality","Making judgments with ""suan""",https://resources.allsetlearning.com/chinese/grammar/ASGWDWFN
她 算 不 算 你 女朋友 ？,她算不算你女朋友？,tā suàn bù suàn nǐ nv̌péngyǒu ？,Is she your girlfriend?,[sound:hsk5_grammar_sent511.mp3],:: Subj. (+ 不) + 算 + Noun ::,"Adding more explanation, Expressing quality","Making judgments with ""suan""",https://resources.allsetlearning.com/chinese/grammar/ASGWDWFN
美国 的 中国 菜 算 中国 菜 吗 ？,美国的中国菜算中国菜吗？,měiguó de zhōngguó cài suàn zhōngguó cài ma ？,Is American Chinese food considered Chinese?,[sound:hsk5_grammar_sent512.mp3],:: Subj. (+ 不) + 算 + Noun ::,"Adding more explanation, Expressing quality","Making judgments with ""suan""",https://resources.allsetlearning.com/chinese/grammar/ASGWDWFN
我们 认识 ，但是 不 算 朋友 。,我们认识，但是不算朋友。,wǒmen rènshì ，dànshì bù suàn péngyǒu 。,"We know, but not friends.",[sound:hsk5_grammar_sent513.mp3],:: Subj. (+ 不) + 算 + Noun ::,"Adding more explanation, Expressing quality","Making judgments with ""suan""",https://resources.allsetlearning.com/chinese/grammar/ASGWDWFN
这 家 店 的 东西 算 便宜 的 。,这家店的东西算便宜的。,zhè jiā diàn de dōngxī suàn biànyí de 。,The things in this shop are cheap.,[sound:hsk5_grammar_sent514.mp3],:: Subj. + 算 + Adj. + 的 ::,"Adding more explanation, Expressing quality","Making judgments with ""suan""",https://resources.allsetlearning.com/chinese/grammar/ASGWDWFN
我 女儿 算 听话 的 。,我女儿算听话的。,wǒ nv̌ér suàn tīnghuà de 。,My daughter is obedient.,[sound:hsk5_grammar_sent515.mp3],:: Subj. + 算 + Adj. + 的 ::,"Adding more explanation, Expressing quality","Making judgments with ""suan""",https://resources.allsetlearning.com/chinese/grammar/ASGWDWFN
在 我们 公司 ，我 算 年轻 的 。,在我们公司，我算年轻的。,zài wǒmen gōngsī ，wǒ suàn niánqīng de 。,"In our company, I am young.",[sound:hsk5_grammar_sent516.mp3],:: Subj. + 算 + Adj. + 的 ::,"Adding more explanation, Expressing quality","Making judgments with ""suan""",https://resources.allsetlearning.com/chinese/grammar/ASGWDWFN
你 老板 算 大方 的 ，我 老板 更 小气 。,你老板算大方的，我老板更小气。,nǐ lǎobǎn suàn dàfāng de ，wǒ lǎobǎn gèng xiǎoqì 。,"Your boss is generous, my boss is more stingy.",[sound:hsk5_grammar_sent517.mp3],:: Subj. + 算 + Adj. + 的 ::,"Adding more explanation, Expressing quality","Making judgments with ""suan""",https://resources.allsetlearning.com/chinese/grammar/ASGWDWFN
这 次 考试 不 算 难 。,这次考试不算难。,zhè cì kǎoshì bù suàn nán 。,This exam is not difficult.,[sound:hsk5_grammar_sent518.mp3],:: Subj. + 不 + 算 + Adj. ::,"Adding more explanation, Expressing quality","Making judgments with ""suan""",https://resources.allsetlearning.com/chinese/grammar/ASGWDWFN
三十 岁 结婚 不 算 晚 。,三十岁结婚不算晚。,sānshí sùi jiéhūn bù suàn wǎn 。,It is not too late to get married at the age of thirty.,[sound:hsk5_grammar_sent519.mp3],:: Subj. + 不 + 算 + Adj. ::,"Adding more explanation, Expressing quality","Making judgments with ""suan""",https://resources.allsetlearning.com/chinese/grammar/ASGWDWFN
他 才 一 米 七 五 ，不 算 高 。,他才一米七五，不算高。,tā cái yī mǐ qī wǔ ，bù suàn gāo 。,"He is only one meter seven or five, not tall.",[sound:hsk5_grammar_sent520.mp3],:: Subj. + 不 + 算 + Adj. ::,"Adding more explanation, Expressing quality","Making judgments with ""suan""",https://resources.allsetlearning.com/chinese/grammar/ASGWDWFN
剪 个 头发 五十 块 ，不 算 贵 。,剪个头发五十块，不算贵。,jiǎn gè tóufā wǔshí kuài ，bù suàn gùi 。,Fifty hair cuts are not expensive.,[sound:hsk5_grammar_sent521.mp3],:: Subj. + 不 + 算 + Adj. ::,"Adding more explanation, Expressing quality","Making judgments with ""suan""",https://resources.allsetlearning.com/chinese/grammar/ASGWDWFN
他 算 天才 。,他算天才。,tā suàn tiāncái 。,He is a genius.,[sound:hsk5_grammar_sent522.mp3],:: Subj. (+ 不) + 算 + Noun :: / :: Subj. + 算 + Adj. + 的 :: / :: Subj. + 不 + 算 + Adj. :: ,"Adding more explanation, Expressing quality","Making judgments with ""suan""",https://resources.allsetlearning.com/chinese/grammar/ASGWDWFN
他 算 是 天才 。,他算是天才。,tā suàn shì tiāncái 。,He is a genius.,[sound:hsk5_grammar_sent523.mp3],:: Subj. (+ 不) + 算 + Noun :: / :: Subj. + 算 + Adj. + 的 :: / :: Subj. + 不 + 算 + Adj. :: ,"Adding more explanation, Expressing quality","Making judgments with ""suan""",https://resources.allsetlearning.com/chinese/grammar/ASGWDWFN
算 你 狠！,算你狠！,suàn nǐ hěn！,you are vicious!,[sound:hsk5_grammar_sent524.mp3],:: Subj. (+ 不) + 算 + Noun :: / :: Subj. + 算 + Adj. + 的 :: / :: Subj. + 不 + 算 + Adj. :: ,"Adding more explanation, Expressing quality","Making judgments with ""suan""",https://resources.allsetlearning.com/chinese/grammar/ASGWDWFN
你 算 老几 ？,你算老几？,nǐ suàn lǎojī ？,How old are you?,[sound:hsk5_grammar_sent525.mp3],:: Subj. (+ 不) + 算 + Noun :: / :: Subj. + 算 + Adj. + 的 :: / :: Subj. + 不 + 算 + Adj. :: ,"Adding more explanation, Expressing quality","Making judgments with ""suan""",https://resources.allsetlearning.com/chinese/grammar/ASGWDWFN
这 不 算 什么 。,这不算什么。,zhè bù suàn shíyāo 。,This is nothing.,[sound:hsk5_grammar_sent526.mp3],:: Subj. (+ 不) + 算 + Noun :: / :: Subj. + 算 + Adj. + 的 :: / :: Subj. + 不 + 算 + Adj. :: ,"Adding more explanation, Expressing quality","Making judgments with ""suan""",https://resources.allsetlearning.com/chinese/grammar/ASGWDWFN
难怪 他，他 还 是 个 孩子 呢，什么 都 不 懂 。,难怪他，他还是个孩子呢，什么都不懂。,nánguài tā，tā huán shì gè háizǐ ní，shíyāo dū bù dǒng 。,"No wonder he, he is a child, knows nothing.",[sound:hsk5_grammar_sent527.mp3],:: 难怪 + [Specific Person / People] ::,Expressing attitude,"Using ""nanguai"" as a verb",https://resources.allsetlearning.com/chinese/grammar/ASGYKH5G
这 也 难怪你，第 一 次 到 这 个 地方 还 不 了解 这里 的 风俗 。,这也难怪你，第一次到这个地方还不了解这里的风俗。,zhè yě nánguàinǐ，dì yī cì dào zhè gè dìfāng huán bù lejiě zhèlǐ de fēngsú 。,It ’s no wonder that you did n’t understand the customs here for the first time.,[sound:hsk5_grammar_sent528.mp3],:: 难怪 + [Specific Person / People] ::,Expressing attitude,"Using ""nanguai"" as a verb",https://resources.allsetlearning.com/chinese/grammar/ASGYKH5G
这 也 难怪，他刚来嘛，算了算了 。,这也难怪，他刚来嘛，算了算了。,zhè yě nánguài，tāgāngláima，suànlesuànle 。,"It's no wonder, he just came, forget it.",[sound:hsk5_grammar_sent529.mp3],:: 难怪 + [Specific Person / People] ::,Expressing attitude,"Using ""nanguai"" as a verb",https://resources.allsetlearning.com/chinese/grammar/ASGYKH5G
这 次 世界杯 将 在 莫斯科 举行 。,这次世界杯将在莫斯科举行。,zhè cì shìjièbēi jiāng zài mòsīkē jǔxíng 。,The World Cup will be held in Moscow.,[sound:hsk5_grammar_sent530.mp3],:: Subj. + 将 / 将要 / 将会 + [Verb Phrase] ::,"Referring to the future, Sequencing events in time","Expressing future with ""jiang""",https://resources.allsetlearning.com/chinese/grammar/ASGIQPUJ
比赛 结果 将 在 月底 公布 。,比赛结果将在月底公布。,bǐsài jiéguǒ jiāng zài yuèdǐ gōngbù 。,The results of the competition will be announced at the end of the month.,[sound:hsk5_grammar_sent531.mp3],:: Subj. + 将 / 将要 / 将会 + [Verb Phrase] ::,"Referring to the future, Sequencing events in time","Expressing future with ""jiang""",https://resources.allsetlearning.com/chinese/grammar/ASGIQPUJ
他 将 会 成为 一 个 成功 的 企业家 。,他将会成为一个成功的企业家。,tā jiāng hùi chéngwèi yī gè chénggōng de qǐyèjiā 。,He will become a successful entrepreneur.,[sound:hsk5_grammar_sent532.mp3],:: Subj. + 将 / 将要 / 将会 + [Verb Phrase] ::,"Referring to the future, Sequencing events in time","Expressing future with ""jiang""",https://resources.allsetlearning.com/chinese/grammar/ASGIQPUJ
如果 政府 不 批准 ，我们 将 会 举行 抗议 。,如果政府不批准，我们将会举行抗议。,rúguǒ zhèngfǔ bù pīzhǔn ，wǒmen jiāng hùi jǔxíng kàngyì 。,"If the government does not approve, we will hold a protest.",[sound:hsk5_grammar_sent533.mp3],:: Subj. + 将 / 将要 / 将会 + [Verb Phrase] ::,"Referring to the future, Sequencing events in time","Expressing future with ""jiang""",https://resources.allsetlearning.com/chinese/grammar/ASGIQPUJ
这个 政策 将 会 大大 改善 农民 的 收入 。,这个政策将会大大改善农民的收入。,zhègè zhèngcè jiāng hùi dàdà gǎishàn nóngmín de shōurù 。,This policy will greatly improve farmers' income.,[sound:hsk5_grammar_sent534.mp3],:: Subj. + 将 / 将要 / 将会 + [Verb Phrase] ::,"Referring to the future, Sequencing events in time","Expressing future with ""jiang""",https://resources.allsetlearning.com/chinese/grammar/ASGIQPUJ
我们 公司 明年 将 要 推出 一 系列 新 产品 。,我们公司明年将要推出一系列新产品。,wǒmen gōngsī míngnián jiāng yào tūichū yī xìliè xīn chǎnpǐn 。,Our company will launch a series of new products next year.,[sound:hsk5_grammar_sent535.mp3],:: Subj. + 将 / 将要 / 将会 + [Verb Phrase] ::,"Referring to the future, Sequencing events in time","Expressing future with ""jiang""",https://resources.allsetlearning.com/chinese/grammar/ASGIQPUJ
政府 将 制定 新 的 行业法规 ，管理 股票 市场 。,政府将制定新的行业法规，管理股票市场。,zhèngfǔ jiāng zhìdìng xīn de xíngyèfǎgūi ，guǎnlǐ gǔpiào shìcháng 。,The government will formulate new industry regulations to manage the stock market.,[sound:hsk5_grammar_sent536.mp3],:: Subj. + 将 / 将要 / 将会 + [Verb Phrase] ::,"Referring to the future, Sequencing events in time","Expressing future with ""jiang""",https://resources.allsetlearning.com/chinese/grammar/ASGIQPUJ
你 会 冷 吗 ？,你会冷吗？,nǐ hùi lěng ma ？,Will you be cold?,[sound:hsk5_grammar_sent537.mp3],:: Subj. + 会 + Predicate + 吗 ？ ::,"Referring to the future, Expressing possibility","The use of Taiwanese Mandarin ""hui""",https://resources.allsetlearning.com/chinese/grammar/ASG22117
这个 会 辣 吗 ？,这个会辣吗？,zhègè hùi là ma ？,Will this be spicy?,[sound:hsk5_grammar_sent538.mp3],:: Subj. + 会 + Predicate + 吗 ？ ::,"Referring to the future, Expressing possibility","The use of Taiwanese Mandarin ""hui""",https://resources.allsetlearning.com/chinese/grammar/ASG22117
刚 开始 说 外语 时 难免 会 有 一些 误会 。,刚开始说外语时难免会有一些误会。,gāng kāishǐ shuō wàiyǔ shí nánmiǎn hùi yǒu yīxiē wùhùi 。,There are some misunderstandings when I first speak a foreign language.,[sound:hsk5_grammar_sent539.mp3],:: (Subj.) + 难免 + Verb ::,Expressing quality,"Expressing ""hard to avoid"" with ""nanmian""",https://resources.allsetlearning.com/chinese/grammar/ASGYDKT3
年轻 人 难免 会 遇到 挫折，关键 是 学习 怎么样 克服 。,年轻人难免会遇到挫折，关键是学习怎么样克服。,niánqīng rén nánmiǎn hùi yùdào cuòzhé，guānjiàn shì xuéxí zěnyāoyáng kèfú 。,"Young people will inevitably encounter setbacks, the key is to learn how to overcome them.",[sound:hsk5_grammar_sent540.mp3],:: (Subj.) + 难免 + Verb ::,Expressing quality,"Expressing ""hard to avoid"" with ""nanmian""",https://resources.allsetlearning.com/chinese/grammar/ASGYDKT3
第 一 次 坐 飞机 出国 难免 会 有点 兴奋 。,第一次坐飞机出国难免会有点兴奋。,dì yī cì zuò fēijī chūguó nánmiǎn hùi yǒudiǎn xīngfèn 。,It is inevitable that I will be a little excited to go abroad for the first time.,[sound:hsk5_grammar_sent541.mp3],:: (Subj.) + 难免 + Verb ::,Expressing quality,"Expressing ""hard to avoid"" with ""nanmian""",https://resources.allsetlearning.com/chinese/grammar/ASGYDKT3
现在 是 高峰期，地铁 难免 会 拥挤 。,现在是高峰期，地铁难免会拥挤。,xiànzài shì gāofēngqī，dìtiě nánmiǎn hùi yǒngjǐ 。,This is the peak period and the subway will inevitably be crowded.,[sound:hsk5_grammar_sent542.mp3],:: (Subj.) + 难免 + Verb ::,Expressing quality,"Expressing ""hard to avoid"" with ""nanmian""",https://resources.allsetlearning.com/chinese/grammar/ASGYDKT3
这家 公司 的 实习生 难免 要 做 一些 打杂 的 事 。,这家公司的实习生难免要做一些打杂的事。,zhèjiā gōngsī de shíxíshēng nánmiǎn yào zuò yīxiē dǎzá de shì 。,Interns in this company will inevitably do some chores.,[sound:hsk5_grammar_sent543.mp3],:: (Subj.) + 难免 + Verb ::,Expressing quality,"Expressing ""hard to avoid"" with ""nanmian""",https://resources.allsetlearning.com/chinese/grammar/ASGYDKT3
我国 提倡 垃圾 分类，以便 回收 再利用 。,我国提倡垃圾分类，以便回收再利用。,wǒguó tíchàng lājí fēnlèi，yǐbiàn húishōu zàilìyòng 。,Our country promotes garbage classification for recycling.,[sound:hsk5_grammar_sent544.mp3],:: [Action] + 以便 + [Outcome] ::,Expressing purpose,"Facilitating an outcome with ""yibian""",https://resources.allsetlearning.com/chinese/grammar/ASGXU2H4
老李 买 了 一 辆 折叠 式 的 自行车，以便 携带 。,老李买了一辆折叠式的自行车，以便携带。,lǎolǐ mǎi le yī liàng zhédié shì de zìxíngchē，yǐbiàn xiédài 。,Lao Li bought a folding bicycle for easy carrying.,[sound:hsk5_grammar_sent545.mp3],:: [Action] + 以便 + [Outcome] ::,Expressing purpose,"Facilitating an outcome with ""yibian""",https://resources.allsetlearning.com/chinese/grammar/ASGXU2H4
老师 减慢 了 语速，以便 学生 能 听懂 。,老师减慢了语速，以便学生能听懂。,lǎoshī jiǎnmàn le yǔsù，yǐbiàn xuéshēng néng tīngdǒng 。,The teacher slowed down his speech so that the students could understand.,[sound:hsk5_grammar_sent546.mp3],:: [Action] + 以便 + [Outcome] ::,Expressing purpose,"Facilitating an outcome with ""yibian""",https://resources.allsetlearning.com/chinese/grammar/ASGXU2H4
张老师的课 很 受 学生 的 欢迎 。,张老师的课很受学生的欢迎。,zhānglǎoshīdekè hěn shòu xuéshēng de huānyíng 。,Teacher Zhang's class is very popular with students.,[sound:hsk5_grammar_sent547.mp3],:: 受 + (到/过) + ([Something / Someone]) + Noun / Verb ::,"Describing actions, Expressing passive voice","Passive verbs with ""shou""",https://resources.allsetlearning.com/chinese/grammar/ASG1DXUD
一个人 不一定 要 变得 很 有钱 或者 很 成功 才 会 受 人 尊重 。,一个人不一定要变得很有钱或者很成功才会受人尊重。,yīgèrén bùyīdìng yào biàndé hěn yǒuqián huòzhě hěn chénggōng cái hùi shòu rén zūnzhòng 。,A person does not have to be rich or successful to be respected.,[sound:hsk5_grammar_sent548.mp3],:: 受 + (到/过) + ([Something / Someone]) + Noun / Verb ::,"Describing actions, Expressing passive voice","Passive verbs with ""shou""",https://resources.allsetlearning.com/chinese/grammar/ASG1DXUD
中国 政府 受老百姓的批评 。,中国政府受老百姓的批评。,zhōngguó zhèngfǔ shòulǎobǎixìngdepīpíng 。,The Chinese government has been criticized by the common people.,[sound:hsk5_grammar_sent549.mp3],:: 受 + (到/过) + ([Something / Someone]) + Noun / Verb ::,"Describing actions, Expressing passive voice","Passive verbs with ""shou""",https://resources.allsetlearning.com/chinese/grammar/ASG1DXUD
受 冷 空气 的 影响，今天 上海 特别 冷 。,受冷空气的影响，今天上海特别冷。,shòu lěng kōngqì de yǐngxiǎng，jīntiān shànghǎi tèbié lěng 。,"Affected by the cold air, Shanghai is particularly cold today.",[sound:hsk5_grammar_sent550.mp3],:: 受 + (到/过) + ([Something / Someone]) + Noun / Verb ::,"Describing actions, Expressing passive voice","Passive verbs with ""shou""",https://resources.allsetlearning.com/chinese/grammar/ASG1DXUD
你 的 手机 昨晚 一直 打不通，我 想 应该 是 受 信号 干扰 。,你的手机昨晚一直打不通，我想应该是受信号干扰。,nǐ de shǒujī zuówǎn yīzhí dǎbùtōng，wǒ xiǎng yìnggāi shì shòu xìnhào gānrǎo 。,"Your phone has been unavailable last night, I think it should be interfered by the signal.",[sound:hsk5_grammar_sent551.mp3],:: 受 + (到/过) + ([Something / Someone]) + Noun / Verb ::,"Describing actions, Expressing passive voice","Passive verbs with ""shou""",https://resources.allsetlearning.com/chinese/grammar/ASG1DXUD
张老师的课 受到 了 很多 学生 的 欢迎 。,张老师的课受到了很多学生的欢迎。,zhānglǎoshīdekè shòudào le hěnduō xuéshēng de huānyíng 。,Teacher Zhang's class has been welcomed by many students.,[sound:hsk5_grammar_sent552.mp3],:: 受 + (到/过) + ([Something / Someone]) + Noun / Verb ::,"Describing actions, Expressing passive voice","Passive verbs with ""shou""",https://resources.allsetlearning.com/chinese/grammar/ASG1DXUD
一个人 不一定 要 变得 很 有钱 或者 很 成功 才 会 受 人 尊重 。,一个人不一定要变得很有钱或者很成功才会受人尊重。,yīgèrén bùyīdìng yào biàndé hěn yǒuqián huòzhě hěn chénggōng cái hùi shòu rén zūnzhòng 。,A person does not have to be rich or successful to be respected.,[sound:hsk5_grammar_sent553.mp3],:: 受 + (到/过) + ([Something / Someone]) + Noun / Verb ::,"Describing actions, Expressing passive voice","Passive verbs with ""shou""",https://resources.allsetlearning.com/chinese/grammar/ASG1DXUD
受 冷 空气 的 影响，今天 上海 特别 冷 。,受冷空气的影响，今天上海特别冷。,shòu lěng kōngqì de yǐngxiǎng，jīntiān shànghǎi tèbié lěng 。,"Affected by the cold air, Shanghai is particularly cold today.",[sound:hsk5_grammar_sent554.mp3],:: 受 + (到/过) + ([Something / Someone]) + Noun / Verb ::,"Describing actions, Expressing passive voice","Passive verbs with ""shou""",https://resources.allsetlearning.com/chinese/grammar/ASG1DXUD
