要不 我们 一起 去 吧 ，一个人 去 没 意思 。,要不我们一起去吧，一个人去没意思。,yàobù wǒmen yīqǐ qù ba ，yīgèrén qù méi yìsī 。,"Or should we go together, it ’s boring to go alone.",[sound:hsk5_grammar_sent245.mp3],:: 要不 + Suggestion ，Reason / Situation :: / :: Reason / Situation ，要不 + Suggestion ::,"Indicating cause and effect, Giving alternatives","Expressing ""how about"" with ""yaobu""",https://resources.allsetlearning.com/chinese/grammar/ASGDFQP7
这个 星期 我 比较 忙 ，要不 下 个 星期 见 ？,这个星期我比较忙，要不下个星期见？,zhègè xīngqī wǒ bǐjiào máng ，yàobù xià gè xīngqī jiàn ？,I ’m busy this week. See you next week?,[sound:hsk5_grammar_sent246.mp3],:: 要不 + Suggestion ，Reason / Situation :: / :: Reason / Situation ，要不 + Suggestion ::,"Indicating cause and effect, Giving alternatives","Expressing ""how about"" with ""yaobu""",https://resources.allsetlearning.com/chinese/grammar/ASGDFQP7
要不 我们 换 个 地方 吧 ，这里 太 吵 了 。,要不我们换个地方吧，这里太吵了。,yàobù wǒmen huàn gè dìfāng ba ，zhèlǐ tài chǎo le 。,"Or should we change places, it's too noisy here.",[sound:hsk5_grammar_sent247.mp3],:: 要不 + Suggestion ，Reason / Situation :: / :: Reason / Situation ，要不 + Suggestion ::,"Indicating cause and effect, Giving alternatives","Expressing ""how about"" with ""yaobu""",https://resources.allsetlearning.com/chinese/grammar/ASGDFQP7
要不 你 先 走 吧 ，我 还没 做完 。,要不你先走吧，我还没做完。,yàobù nǐ xiān zǒu ba ，wǒ huánméi zuòwán 。,"Or you go first, I haven't finished it yet.",[sound:hsk5_grammar_sent248.mp3],:: 要不 + Suggestion ，Reason / Situation :: / :: Reason / Situation ，要不 + Suggestion ::,"Indicating cause and effect, Giving alternatives","Expressing ""how about"" with ""yaobu""",https://resources.allsetlearning.com/chinese/grammar/ASGDFQP7
下雨 了，要不 明天 去 吧 。,下雨了，要不明天去吧。,xiàyǔ le，yàobù míngtiān qù ba 。,"It's raining, or go tomorrow.",[sound:hsk5_grammar_sent249.mp3],:: 要不 + Suggestion ，Reason / Situation :: / :: Reason / Situation ，要不 + Suggestion ::,"Indicating cause and effect, Giving alternatives","Expressing ""how about"" with ""yaobu""",https://resources.allsetlearning.com/chinese/grammar/ASGDFQP7
这么 远 ，要不 我 开车 送 你 去 ？,这么远，要不我开车送你去？,zhèyāo yuǎn ，yàobù wǒ kāichē sòng nǐ qù ？,"So far, or should I drive you?",[sound:hsk5_grammar_sent250.mp3],:: 要不 + Suggestion ，Reason / Situation :: / :: Reason / Situation ，要不 + Suggestion ::,"Indicating cause and effect, Giving alternatives","Expressing ""how about"" with ""yaobu""",https://resources.allsetlearning.com/chinese/grammar/ASGDFQP7
你 先 吃 吧 ，要 不然 饭 就 凉 了 。,你先吃吧，要不然饭就凉了。,nǐ xiān chī ba ，yào bùrán fàn jìu liáng le 。,"Eat it first, or the food will be cold.",[sound:hsk5_grammar_sent251.mp3],:: 要不 + Suggestion ，Reason / Situation :: / :: Reason / Situation ，要不 + Suggestion ::,"Indicating cause and effect, Giving alternatives","Expressing ""how about"" with ""yaobu""",https://resources.allsetlearning.com/chinese/grammar/ASGDFQP7
打车 吧 ，要不 会 迟到 的 。,打车吧，要不会迟到的。,dǎchē ba ，yàobù hùi chídào de 。,"Take a taxi, or you will be late.",[sound:hsk5_grammar_sent252.mp3],:: 要不 + Suggestion ，Reason / Situation :: / :: Reason / Situation ，要不 + Suggestion ::,"Indicating cause and effect, Giving alternatives","Expressing ""how about"" with ""yaobu""",https://resources.allsetlearning.com/chinese/grammar/ASGDFQP7
快 回家 吧 ，要不 你 爸妈 会 担心 的 。,快回家吧，要不你爸妈会担心的。,kuài húijiā ba ，yàobù nǐ bàmā hùi dànxīn de 。,"Come home quickly, otherwise your parents will be worried.",[sound:hsk5_grammar_sent253.mp3],:: 要不 + Suggestion ，Reason / Situation :: / :: Reason / Situation ，要不 + Suggestion ::,"Indicating cause and effect, Giving alternatives","Expressing ""how about"" with ""yaobu""",https://resources.allsetlearning.com/chinese/grammar/ASGDFQP7
你们 这样 做 其实 是 彼此 伤害 。,你们这样做其实是彼此伤害。,nǐmen zhèyáng zuò qíshí shì bǐcǐ shānghài 。,You actually hurt each other by doing so.,[sound:hsk5_grammar_sent254.mp3],:: 彼此 + Verb ::,,"Comparing ""bici"" and ""duifang""",https://resources.allsetlearning.com/chinese/grammar/ASG84D65
结婚 以前 夫妻 应该 多 花 时间 彼此 了解 。,结婚以前夫妻应该多花时间彼此了解。,jiéhūn yǐqián fūqī yìnggāi duō huā shíjiān bǐcǐ lejiě 。,"Before marriage, couples should spend more time understanding each other.",[sound:hsk5_grammar_sent255.mp3],:: 彼此 + Verb ::,,"Comparing ""bici"" and ""duifang""",https://resources.allsetlearning.com/chinese/grammar/ASG84D65
我们 是 一 个 部门 的，工作 上 要 彼此 配合 。,我们是一个部门的，工作上要彼此配合。,wǒmen shì yī gè bùmén de，gōngzuò shàng yào bǐcǐ pèihé 。,"We are a department, and we must cooperate with each other in our work.",[sound:hsk5_grammar_sent256.mp3],:: 彼此 + Verb ::,,"Comparing ""bici"" and ""duifang""",https://resources.allsetlearning.com/chinese/grammar/ASG84D65
如果 你们 不 能 彼此 信任，这 次 合作 不 太 可能 成功 。,如果你们不能彼此信任，这次合作不太可能成功。,rúguǒ nǐmen bù néng bǐcǐ xìnrèn，zhè cì hézuò bù tài kěnéng chénggōng 。,"If you cannot trust each other, this cooperation is unlikely to succeed.",[sound:hsk5_grammar_sent257.mp3],:: 彼此 + Verb ::,,"Comparing ""bici"" and ""duifang""",https://resources.allsetlearning.com/chinese/grammar/ASG84D65
照顾 彼此 。,照顾彼此。,zhàogù bǐcǐ 。,Take care of each other.,[sound:hsk5_grammar_sent258.mp3],:: Verb + 彼此 / 对方 ::,,"Comparing ""bici"" and ""duifang""",https://resources.allsetlearning.com/chinese/grammar/ASG84D65
原谅 对方 。,原谅对方。,yuánliàng dùifāng 。,Forgive each other.,[sound:hsk5_grammar_sent259.mp3],:: Verb + 彼此 / 对方 ::,,"Comparing ""bici"" and ""duifang""",https://resources.allsetlearning.com/chinese/grammar/ASG84D65
信任 彼此 。,信任彼此。,xìnrèn bǐcǐ 。,Trust each other.,[sound:hsk5_grammar_sent260.mp3],:: Verb + 彼此 / 对方 ::,,"Comparing ""bici"" and ""duifang""",https://resources.allsetlearning.com/chinese/grammar/ASG84D65
尊重 对方 。,尊重对方。,zūnzhòng dùifāng 。,Respect each other.,[sound:hsk5_grammar_sent261.mp3],:: Verb + 彼此 / 对方 ::,,"Comparing ""bici"" and ""duifang""",https://resources.allsetlearning.com/chinese/grammar/ASG84D65
你们 应该 多 关注 彼此 的 优点 。,你们应该多关注彼此的优点。,nǐmen yìnggāi duō guānzhù bǐcǐ de yōudiǎn 。,You should pay more attention to each other's strengths.,[sound:hsk5_grammar_sent262.mp3],:: 彼此 + 的 + Noun ::,,"Comparing ""bici"" and ""duifang""",https://resources.allsetlearning.com/chinese/grammar/ASG84D65
他 跟 人 说话 的时候 常常 忽视 对方 的 感受 。,他跟人说话的时候常常忽视对方的感受。,tā gēn rén shuōhuà deshíhòu chángcháng hūshì dùifāng de gǎnshòu 。,"When he talks to people, he often ignores each other's feelings.",[sound:hsk5_grammar_sent263.mp3],:: 彼此 + 的 + Noun ::,,"Comparing ""bici"" and ""duifang""",https://resources.allsetlearning.com/chinese/grammar/ASG84D65
我 道歉 了 ，但是 对方 不 接受 。,我道歉了，但是对方不接受。,wǒ dàoqiàn le ，dànshì dùifāng bù jiēshòu 。,"I apologized, but the other party did not accept it.",[sound:hsk5_grammar_sent264.mp3],:: 对方 + Predicate ::,,"Comparing ""bici"" and ""duifang""",https://resources.allsetlearning.com/chinese/grammar/ASG84D65
我 问 了 人家 ，但是 对方 不 同意 。,我问了人家，但是对方不同意。,wǒ wèn le rénjiā ，dànshì dùifāng bù tóngyì 。,"I asked others, but the other party disagreed.",[sound:hsk5_grammar_sent265.mp3],:: 对方 + Predicate ::,,"Comparing ""bici"" and ""duifang""",https://resources.allsetlearning.com/chinese/grammar/ASG84D65
你 那样 说 会 让 对方 很 不 舒服 的 。,你那样说会让对方很不舒服的。,nǐ nàyáng shuō hùi ràng dùifāng hěn bù shūfú de 。,It's uncomfortable for you to say that.,[sound:hsk5_grammar_sent266.mp3],:: 对方 + Predicate ::,,"Comparing ""bici"" and ""duifang""",https://resources.allsetlearning.com/chinese/grammar/ASG84D65
跟 朋友 吵架 的时候 ，我们 都 希望 对方 能 先 道歉 。,跟朋友吵架的时候，我们都希望对方能先道歉。,gēn péngyǒu chǎojià deshíhòu ，wǒmen dū xīwàng dùifāng néng xiān dàoqiàn 。,"When arguing with friends, we all hope that the other party will apologize first.",[sound:hsk5_grammar_sent267.mp3],:: 对方 + Predicate ::,,"Comparing ""bici"" and ""duifang""",https://resources.allsetlearning.com/chinese/grammar/ASG84D65
你 是 我 所有 朋友 当中 最 聪明 的 一 个 。,你是我所有朋友当中最聪明的一个。,nǐ shì wǒ suǒyǒu péngyǒu dāngzhōng zùi cōngmíng de yī gè 。,You are the smartest of all my friends.,[sound:hsk5_grammar_sent268.mp3],:: Group + 当中 :: / :: Process + 当中 ::,"Describing actions, Describing things","Expressing ""among"" with ""dangzhong""",https://resources.allsetlearning.com/chinese/grammar/ASGS4DBY
在 这 一百 个 选手 当中 我 表现 得 最 出色 。,在这一百个选手当中我表现得最出色。,zài zhè yībǎi gè xuǎnshǒu dāngzhōng wǒ biǎoxiàn dé zùi chūsè 。,"Among the 100 players, I performed the best.",[sound:hsk5_grammar_sent269.mp3],:: Group + 当中 :: / :: Process + 当中 ::,"Describing actions, Describing things","Expressing ""among"" with ""dangzhong""",https://resources.allsetlearning.com/chinese/grammar/ASGS4DBY
这 个 工程 还在 计划 当中 。,这个工程还在计划当中。,zhè gè gōngchéng huánzài jìhuá dāngzhōng 。,This project is still being planned.,[sound:hsk5_grammar_sent270.mp3],:: Group + 当中 :: / :: Process + 当中 ::,"Describing actions, Describing things","Expressing ""among"" with ""dangzhong""",https://resources.allsetlearning.com/chinese/grammar/ASGS4DBY
我们 只 见 过 一 次 ，彼此 不是 很 了解 。,我们只见过一次，彼此不是很了解。,wǒmen zhǐ jiàn guò yī cì ，bǐcǐ bùshì hěn lejiě 。,We have only seen it once and we don't know each other very well.,[sound:hsk5_grammar_sent271.mp3],:: Verb + 彼此 :: / :: 彼此 + Verb ::,,"Expressing ""each other"" with ""bici""",https://resources.allsetlearning.com/chinese/grammar/ASGF205D
我们 是 一个 团队 ，彼此 应该 多 沟通 。,我们是一个团队，彼此应该多沟通。,wǒmen shì yīgè tuándùi ，bǐcǐ yìnggāi duō gōutōng 。,We are a team and should communicate more with each other.,[sound:hsk5_grammar_sent272.mp3],:: Verb + 彼此 :: / :: 彼此 + Verb ::,,"Expressing ""each other"" with ""bici""",https://resources.allsetlearning.com/chinese/grammar/ASGF205D
我 很 尊重 我 的 对手 ，我 希望 彼此 都 能 有 好 的 表现 。,我很尊重我的对手，我希望彼此都能有好的表现。,wǒ hěn zūnzhòng wǒ de dùishǒu ，wǒ xīwàng bǐcǐ dū néng yǒu hǎo de biǎoxiàn 。,"I respect my opponents very much, and I hope each other can perform well.",[sound:hsk5_grammar_sent273.mp3],:: Verb + 彼此 :: / :: 彼此 + Verb ::,,"Expressing ""each other"" with ""bici""",https://resources.allsetlearning.com/chinese/grammar/ASGF205D
我们 是 一家人 ，必须 好好 照顾 彼此 。,我们是一家人，必须好好照顾彼此。,wǒmen shì yījiārén ，bìxū hǎohǎo zhàogù bǐcǐ 。,We are a family and we must take good care of each other.,[sound:hsk5_grammar_sent274.mp3],:: Verb + 彼此 :: / :: 彼此 + Verb ::,,"Expressing ""each other"" with ""bici""",https://resources.allsetlearning.com/chinese/grammar/ASGF205D
好朋友 总是 会 陪伴 彼此 。,好朋友总是会陪伴彼此。,hǎopéngyǒu zǒngshì hùi péibàn bǐcǐ 。,Good friends always accompany each other.,[sound:hsk5_grammar_sent275.mp3],:: Verb + 彼此 :: / :: 彼此 + Verb ::,,"Expressing ""each other"" with ""bici""",https://resources.allsetlearning.com/chinese/grammar/ASGF205D
你们 是 夫妻 ，怎么 一点也不 信任 彼此 ？,你们是夫妻，怎么一点也不信任彼此？,nǐmen shì fūqī ，zěnyāo yīdiǎnyěbù xìnrèn bǐcǐ ？,"You are a husband and wife, why don't you trust each other at all?",[sound:hsk5_grammar_sent276.mp3],:: Verb + 彼此 :: / :: 彼此 + Verb ::,,"Expressing ""each other"" with ""bici""",https://resources.allsetlearning.com/chinese/grammar/ASGF205D
过去 一年 ，我们 见证 了彼此 的 进步 。,过去一年，我们见证了彼此的进步。,guòqù yīnián ，wǒmen jiànzhèng lebǐcǐ de jìnbù 。,"In the past year, we have witnessed each other's progress.",[sound:hsk5_grammar_sent277.mp3],:: 彼此 + 的 + Noun ::,,"Expressing ""each other"" with ""bici""",https://resources.allsetlearning.com/chinese/grammar/ASGF205D
大家 都 很 辛苦 ，我们 需要 尊重 彼此 的 努力 。,大家都很辛苦，我们需要尊重彼此的努力。,dàjiā dū hěn xīnkǔ ，wǒmen xūyào zūnzhòng bǐcǐ de nǔlì 。,"Everyone is very hard, we need to respect each other's efforts.",[sound:hsk5_grammar_sent278.mp3],:: 彼此 + 的 + Noun ::,,"Expressing ""each other"" with ""bici""",https://resources.allsetlearning.com/chinese/grammar/ASGF205D
我们 十年 没 见 了 ，对 彼此 的 生活 都 不 了解 ，也 很 惊讶 彼此 的 变化 。,我们十年没见了，对彼此的生活都不了解，也很惊讶彼此的变化。,wǒmen shínián méi jiàn le ，dùi bǐcǐ de shēnghuó dū bù lejiě ，yě hěn liángyà bǐcǐ de biànhuà 。,We have n’t seen each other for ten years. We do n’t know each other ’s lives and are surprised at each other ’s changes.,[sound:hsk5_grammar_sent279.mp3],:: 彼此 + 的 + Noun ::,,"Expressing ""each other"" with ""bici""",https://resources.allsetlearning.com/chinese/grammar/ASGF205D
今年 八月 以来 ，这里 一直 没 下 过 雨 。,今年八月以来，这里一直没下过雨。,jīnnián bāyuè yǐlái ，zhèlǐ yīzhí méi xià guò yǔ 。,It has not rained here since August this year.,[sound:hsk5_grammar_sent280.mp3],:: Time / Event + 以来 ，⋯⋯ ::,"Referring to the past, Sequencing events in time","Expressing ""ever since"" with ""yilai""",https://resources.allsetlearning.com/chinese/grammar/ASGNEMXP
结婚 以来 ，我们 没 吵 过 架 。,结婚以来，我们没吵过架。,jiéhūn yǐlái ，wǒmen méi chǎo guò jià 。,We haven't quarreled since we got married.,[sound:hsk5_grammar_sent281.mp3],:: Time / Event + 以来 ，⋯⋯ ::,"Referring to the past, Sequencing events in time","Expressing ""ever since"" with ""yilai""",https://resources.allsetlearning.com/chinese/grammar/ASGNEMXP
上 大学 以来 ，他 变 了 很 多 。,上大学以来，他变了很多。,shàng dàxué yǐlái ，tā biàn le hěn duō 。,He has changed a lot since he went to college.,[sound:hsk5_grammar_sent282.mp3],:: Time / Event + 以来 ，⋯⋯ ::,"Referring to the past, Sequencing events in time","Expressing ""ever since"" with ""yilai""",https://resources.allsetlearning.com/chinese/grammar/ASGNEMXP
从 他 爸爸 去世 以来 ，他 就 没有 回 过 家 。,从他爸爸去世以来，他就没有回过家。,cóng tā bàbà qùshì yǐlái ，tā jìu méiyǒu húi guò jiā 。,"Since his father's death, he has not returned home.",[sound:hsk5_grammar_sent283.mp3],:: Time / Event + 以来 ，⋯⋯ ::,"Referring to the past, Sequencing events in time","Expressing ""ever since"" with ""yilai""",https://resources.allsetlearning.com/chinese/grammar/ASGNEMXP
从 我 学 汉语 以来 ，我 认识 了 很多 中国 朋友 。,从我学汉语以来，我认识了很多中国朋友。,cóng wǒ xué hànyǔ yǐlái ，wǒ rènshì le hěnduō zhōngguó péngyǒu 。,"Since I learned Chinese, I have met many Chinese friends.",[sound:hsk5_grammar_sent284.mp3],:: Time / Event + 以来 ，⋯⋯ ::,"Referring to the past, Sequencing events in time","Expressing ""ever since"" with ""yilai""",https://resources.allsetlearning.com/chinese/grammar/ASGNEMXP
十 年 来，房价 一直 在 涨 。,十年来，房价一直在涨。,shí nián lái，fángjià yīzhí zài zhǎng 。,"For ten years, house prices have been rising.",[sound:hsk5_grammar_sent285.mp3],:: Time Period + 来 ，⋯⋯ ::,"Referring to the past, Sequencing events in time","Expressing ""ever since"" with ""yilai""",https://resources.allsetlearning.com/chinese/grammar/ASGNEMXP
几 年 来 ，我们 公司 的 收入 一直 在 增加 。,几年来，我们公司的收入一直在增加。,jī nián lái ，wǒmen gōngsī de shōurù yīzhí zài zēngjiā 。,"For several years, our company's revenue has been increasing.",[sound:hsk5_grammar_sent286.mp3],:: Time Period + 来 ，⋯⋯ ::,"Referring to the past, Sequencing events in time","Expressing ""ever since"" with ""yilai""",https://resources.allsetlearning.com/chinese/grammar/ASGNEMXP
实习 几 个 月 来 ，我 学到 了 很 多 。,实习几个月来，我学到了很多。,shíxí jī gè yuè lái ，wǒ xuédào le hěn duō 。,"Over the past few months, I have learned a lot.",[sound:hsk5_grammar_sent287.mp3],:: Time Period + 来 ，⋯⋯ ::,"Referring to the past, Sequencing events in time","Expressing ""ever since"" with ""yilai""",https://resources.allsetlearning.com/chinese/grammar/ASGNEMXP
出国 几 个 月 来 ，她 一点 也 不 想 家 。,出国几个月来，她一点也不想家。,chūguó jī gè yuè lái ，tā yīdiǎn yě bù xiǎng jiā 。,"For months after going abroad, she didn't want to go home at all.",[sound:hsk5_grammar_sent288.mp3],:: Time Period + 来 ，⋯⋯ ::,"Referring to the past, Sequencing events in time","Expressing ""ever since"" with ""yilai""",https://resources.allsetlearning.com/chinese/grammar/ASGNEMXP
离婚 这 几 年 来 ，他 从 没 去 看 过 孩子 。,离婚这几年来，他从没去看过孩子。,líhūn zhè jī nián lái ，tā cóng méi qù kàn guò háizǐ 。,"In the past few years of divorce, he has never seen a child.",[sound:hsk5_grammar_sent289.mp3],:: Time Period + 来 ，⋯⋯ ::,"Referring to the past, Sequencing events in time","Expressing ""ever since"" with ""yilai""",https://resources.allsetlearning.com/chinese/grammar/ASGNEMXP
这 三 个 月 来 ，我 每天 都 在 想 她 。,这三个月来，我每天都在想她。,zhè sān gè yuè lái ，wǒ měitiān dū zài xiǎng tā 。,"For the past three months, I think about her every day.",[sound:hsk5_grammar_sent290.mp3],:: Time Period + 来 ，⋯⋯ ::,"Referring to the past, Sequencing events in time","Expressing ""ever since"" with ""yilai""",https://resources.allsetlearning.com/chinese/grammar/ASGNEMXP
你 这个 坏蛋，就 没 做 过 一 件 好 事 。,你这个坏蛋，就没做过一件好事。,nǐ zhègè huàidàn，jìu méi zuò guò yī jiàn hǎo shì 。,"You bad guy, never did a good thing.",[sound:hsk5_grammar_sent291.mp3],:: Subj. + 这个 /  这种 / 这类 + [Category] ::,"Describing people, Describing things, Emphasizing, Differentiating","Name-calling with ""zhege""",https://resources.allsetlearning.com/chinese/grammar/ASGNPO4V
他 这个 马屁精，又 去 拍 老板 的 马屁 了 。,他这个马屁精，又去拍老板的马屁了。,tā zhègè mǎpìjīng，yòu qù pāi lǎobǎn de mǎpì le 。,"He asshole, went to pat the boss's ass.",[sound:hsk5_grammar_sent292.mp3],:: Subj. + 这个 /  这种 / 这类 + [Category] ::,"Describing people, Describing things, Emphasizing, Differentiating","Name-calling with ""zhege""",https://resources.allsetlearning.com/chinese/grammar/ASGNPO4V
上海 这个 城市，夏天 太 热，冬天 太 冷 。,上海这个城市，夏天太热，冬天太冷。,shànghǎi zhègè chéngshì，xiàtiān tài rè，dōngtiān tài lěng 。,The city of Shanghai is too hot in summer and too cold in winter.,[sound:hsk5_grammar_sent293.mp3],:: Subj. + 这个 /  这种 / 这类 + [Category] ::,"Describing people, Describing things, Emphasizing, Differentiating","Name-calling with ""zhege""",https://resources.allsetlearning.com/chinese/grammar/ASGNPO4V
猕猴桃 这种 水果，营养 价值 最 高 。,猕猴桃这种水果，营养价值最高。,míhóutáo zhèzhǒng shǔiguǒ，yíngyǎng jiàzhí zùi gāo 。,Kiwi fruit is the fruit with the highest nutritional value.,[sound:hsk5_grammar_sent294.mp3],:: Subj. + 这个 /  这种 / 这类 + [Category] ::,"Describing people, Describing things, Emphasizing, Differentiating","Name-calling with ""zhege""",https://resources.allsetlearning.com/chinese/grammar/ASGNPO4V
钱 这种 东西，可以 有 可以 没有 。,钱这种东西，可以有可以没有。,qián zhèzhǒng dōngxī，kěyǐ yǒu kěyǐ méiyǒu 。,There is no such thing as money.,[sound:hsk5_grammar_sent295.mp3],:: Subj. + 这个 /  这种 / 这类 + [Category] ::,"Describing people, Describing things, Emphasizing, Differentiating","Name-calling with ""zhege""",https://resources.allsetlearning.com/chinese/grammar/ASGNPO4V
我 上 了 课 。,我上了课。,wǒ shàng le kè 。,I took the class.,[sound:hsk5_grammar_sent296.mp3],:: Subj. + Verb + 了 + Obj. :: / :: Subj. + Verb + Obj. + 了 ::,"Describing actions, Referring to the past, Expressing completion","Advanced ""le"" after an object",https://resources.allsetlearning.com/chinese/grammar/ASG4K5WH
老师 问 了 问题 。,老师问了问题。,lǎoshī wèn le wèntí 。,The teacher asked a question.,[sound:hsk5_grammar_sent297.mp3],:: Subj. + Verb + 了 + Obj. :: / :: Subj. + Verb + Obj. + 了 ::,"Describing actions, Referring to the past, Expressing completion","Advanced ""le"" after an object",https://resources.allsetlearning.com/chinese/grammar/ASG4K5WH
他 买 了 一辆 车 。,他买了一辆车。,tā mǎi le yīliàng chē 。,He bought a car.,[sound:hsk5_grammar_sent298.mp3],:: Subj. + Verb + 了 + Obj. :: / :: Subj. + Verb + Obj. + 了 ::,"Describing actions, Referring to the past, Expressing completion","Advanced ""le"" after an object",https://resources.allsetlearning.com/chinese/grammar/ASG4K5WH
妈妈 做 了 很多 菜 。,妈妈做了很多菜。,māmā zuò le hěnduō cài 。,Mom made many dishes.,[sound:hsk5_grammar_sent299.mp3],:: Subj. + Verb + 了 + Obj. :: / :: Subj. + Verb + Obj. + 了 ::,"Describing actions, Referring to the past, Expressing completion","Advanced ""le"" after an object",https://resources.allsetlearning.com/chinese/grammar/ASG4K5WH
我们 吃 了 印度 菜 。,我们吃了印度菜。,wǒmen chī le yìndù cài 。,We had Indian food.,[sound:hsk5_grammar_sent300.mp3],:: Subj. + Verb + 了 + Obj. :: / :: Subj. + Verb + Obj. + 了 ::,"Describing actions, Referring to the past, Expressing completion","Advanced ""le"" after an object",https://resources.allsetlearning.com/chinese/grammar/ASG4K5WH
她 穿 了 最漂亮 的 裙子 。,她穿了最漂亮的裙子。,tā chuān le zùipiāoliàng de qúnzǐ 。,She wears the most beautiful dress.,[sound:hsk5_grammar_sent301.mp3],:: Subj. + Verb + 了 + Obj. :: / :: Subj. + Verb + Obj. + 了 ::,"Describing actions, Referring to the past, Expressing completion","Advanced ""le"" after an object",https://resources.allsetlearning.com/chinese/grammar/ASG4K5WH
我 昨天 看 了 电影 。,我昨天看了电影。,wǒ zuótiān kàn le diànyǐng 。,I watched the movie yesterday.,[sound:hsk5_grammar_sent302.mp3],:: Subj. + Verb + 了 + Obj. :: / :: Subj. + Verb + Obj. + 了 ::,"Describing actions, Referring to the past, Expressing completion","Advanced ""le"" after an object",https://resources.allsetlearning.com/chinese/grammar/ASG4K5WH
我 和 同事 一起 吃 了 饭 。,我和同事一起吃了饭。,wǒ hé tóngshì yīqǐ chī le fàn 。,I ate with my colleagues.,[sound:hsk5_grammar_sent303.mp3],:: Subj. + Verb + 了 + Obj. :: / :: Subj. + Verb + Obj. + 了 ::,"Describing actions, Referring to the past, Expressing completion","Advanced ""le"" after an object",https://resources.allsetlearning.com/chinese/grammar/ASG4K5WH
我们 在 动物园 和 熊猫 拍 了 照 。,我们在动物园和熊猫拍了照。,wǒmen zài dòngwùyuán hé xióngmāo pāi le zhào 。,We took photos with the panda at the zoo.,[sound:hsk5_grammar_sent304.mp3],:: Subj. + Verb + 了 + Obj. :: / :: Subj. + Verb + Obj. + 了 ::,"Describing actions, Referring to the past, Expressing completion","Advanced ""le"" after an object",https://resources.allsetlearning.com/chinese/grammar/ASG4K5WH
他 女朋友 为了 他 辞 了 工作 。,他女朋友为了他辞了工作。,tā nv̌péngyǒu wèile tā cí le gōngzuò 。,His girlfriend quit his job for him.,[sound:hsk5_grammar_sent305.mp3],:: Subj. + Verb + 了 + Obj. :: / :: Subj. + Verb + Obj. + 了 ::,"Describing actions, Referring to the past, Expressing completion","Advanced ""le"" after an object",https://resources.allsetlearning.com/chinese/grammar/ASG4K5WH
